,name,votes,winner,win_difference
2323,"Keith & Natani buried at the beach, sand shaped like Merfolk tails. A wave reveals actual Merfolk tails",5,False,0
3363,Keith trains Basitin Trace.,5,False,0
3365,"Clovis as a dual sided lightsaber wielding Sith, with both sexy and cool looking ""armor""",5,False,0
2367,Raine vs trace staring contest but goes magically awry,5,False,0
5180,Laura and Keith on a romantic fishing trip. Laura teaches Keith how to fish the Coastal Fox way.,5,False,0
2742,Kat going to a modern university.,5,False,0
3502,Main four enjoy a warm bonfire one evening,5,False,0
3500,Keith recalling some of his happiest moments while living with Laura.,5,False,0
5396,Festive Flora baby bump!,5,False,0
8892,"The Templars (or evil wolves) think that they have captured Raine, but to their horror this is Nora in the wolf form.",5,False,0
2227,Sythe as a reluctant squirrel mascot for Nibbly world.,5,False,0
3455,Luchador Adelaide suplexing a mask.,5,False,0
3491,What if: Sealeen & Lynn family portrait,5,False,0
3515,"Zen and Natani arguing over the better assassin: Kathrin trained by Natani, or Raine trained by Zen.",5,False,0
23,Clovis Virgin sweater,5,False,0
8699,Chimera asks Trace and Flora to help her pick a name,5,False,0
8073,Mike meets Fem-Mike and Very Vixen Mike ,5,False,0
2684,Natani in N7 outfit & equip. Female (Mass) & male (effect) versions.,5,False,0
5156,"Maren, Roselyn, and Fem! Eric as the Sanderson sisters from Hocus Pocus",5,False,0
3529,"Magic Karaoke night at the Estate, who is the best? who is the worst? and who sings death metal? ",5,False,0
2250,Reni's magic stuff collection room.,5,False,0
3513,Kat turned Basitin thanks to another magic mishap,5,False,0
3496,Frankenstein monster escapes her Creator and meets Raine,5,False,0
8501,The Rocky Horror Twokinds Show! Trace- Brad Majors Flora- Janet Weiss Natani - Riff Raff Keith - Magenta Kat - Columbia  Human Nora- Frank'N'Furter ,5,False,0
3433,"Twokinds Sims - w/ Trace, Flora, Keith & Natani as sims & Tom himself as a player, making them do things they hate",5,False,0
5235,"Adelaide's First  Date Part 2: Maddie's father tries to flee the castle the morning after, but Adelaide won't let him go. (Similar to page 796)",5,False,0
2316,Flora as Tracer from Overwatch,5,False,0
2311,Trace goes Super Saiyan!,5,False,0
8676,"""Lupus Dei!"" Nat and Zen on guitar, Sythe on the mic, Raine on organ, and Brutus on drums, dressed up in the style of Powerwolf, and ready to rock!",5,False,0
2304,All the TK villains surrounding red eyed dark trace sitting on an evil throne,5,False,0
4491,Natani takes Keith for a walk on a leash - lost bet.,5,False,0
4492,Older Maeve and Maddie share their first kiss. Maddie gets extremely flustered afterwards.,5,False,0
3149,Seraphina babysitting Madelyn and Maeve.,5,False,0
9030,Half-keidran Raine meets human Holo from the “Spice and Wolf”.,5,False,0
8780,Redraw of main panel from page 435 - Kat preparing to massage Flora,5,False,0
2047,The Female Main Character from the Halfkind comic Returns!,5,False,0
4483,Nora finds a new romantic interest after seeing Raine show a display of her magical potential.,5,False,0
1052,Natani Dakimakura (Body Pillow),5,False,0
68,Keith as Raiden and/or Zen as Jetstream Sam (Metal Gear Rising),5,False,0
1051,Wrinry gets her wings back.,5,False,0
1071,Carver as Zorg and (whichever form works best) Raine as Leeloo from the Fifth Element,5,False,0
4347,Keith teaching Basitin Trace the culture of his species.,5,False,0
1410,Group B theater rehearsal with Red as the director,5,False,0
8318,"Older Keith and Natani, watching their kids play in leaf piles",5,False,0
3393,Indiana Raine whipping a crossbow out of a guards hand.,5,False,0
2596,"Curious about their relationship, LT. Reed attempts to spy on Trace & Flora",5,False,0
3394,"Magic Item Mishaps: Reni shows off her first magic item to Kei, who gets accidentally transformed.",5,False,0
3398,Evil trace in a magic suppressing straitjacket in solitary confinement ,5,False,0
3408,"Evals’s home is being destroyed & he, along w/ others, are taken into slavery.",5,False,0
2729,Human Sythe + Nibbly's reaction,5,False,0
6973,Sequel to Fallout Mekkan sketch in which Keith and Natani explore the Sierra Madre and find Hologram Laura,5,False,0
4441,"Flora as a Sister of Battle and Trace as a Commissar, shouting inspirational stuff like Trace always does :P",5,False,0
8952,"Remake of Trace rescuing Laura from the cage on page 587. Plot twist! There's a mistletoe booby trap! Since Trace murdered everyone in the vicinity, there's nobody to intervene, so they smooch until they fall asleep, still in each other's embrace.",5,False,0
6954,Office Secretary Flora showing off her new suit with a confident pose,5,False,0
4448,Cathleen teaching young Keith how to fight with a spear Western Basitin style,5,False,0
7865,Natani mocks a flustered Zen as Kat gives him a bath.,5,False,0
2567,Maren in a pretty dress,5,False,0
4424,One of the human girls from Two Kinds as a Sister of Battle from 40K,5,False,0
2592,"Backside comparison, sythe & zen w/ Nibbly as judge.",5,False,0
2295,"A human guard attempts to flirt with a female Basitin by ""accidentally"" showing some ankle, So lewd!",5,False,0
2594,Auditions to Twokinds: The Movie,5,False,0
5454,The explorers arrive at a Tiger village and receive a warm welcome from the locals,5,False,0
1433,StarWars Episode 3's high ground scene with Keith and Alaric.,5,False,0
1387,"Young Flora looking up at the lights of Legacy Estate at night, wondering who lives up there.",5,False,0
1634,"Flora as Flo the insurance lady, overwhelmed by all the claims from Edinmire.",5,False,0
6812,Sealeen helps Windstraw to brew very special beer.,5,False,0
3280,Laura daki,5,False,0
2374,Twokinds characters as Pokémon or Pokémon characters,5,False,0
8026,Femboy Hooters Keith against Tomboy Outback Youngtani,5,False,0
4746,Karen and Maddie discover that trying to escape the estate's dungeons sets of retaliatory transformation magics,5,False,0
3267,Trace asks flora to do him a favour if he becomes his evil self again,5,False,0
8445,"Dark AU Emperor Sythe and his High Generals Evals and Mike, rally their armies in preparation to conquer the world.",5,False,0
3326,Raine hides from Maren and Red as she overhears them talking about her behind her back,5,False,0
7067,Keith and Natani on a walk in the woods. Zen makes faces from a tree. ,5,False,0
1602,Nibs steals Trace and Flora's bathing suits: Nib nab round 3,5,False,0
3328,Human Nora dressed up as Lulu from Final Fantasy X with Tiger Trace plushie.,5,False,0
4726,Laura World Order. What if Laura was Grand Templar instead of Trace?,5,False,0
2419,Wolf Red’s primal instincts kick in and he chases his tail,5,False,0
2445,Reni attempts transformation magic and changes an unsuspecting Kei. Hijinks ensue.,5,False,0
4860,"Adult Maeve tries to convince Maddie to put on a swimsuit for a beach trip, and poor Maddie freaks out at wearing something so revealing",5,False,0
3274,Mrs Nibbs unleashing some SQUIRRLY WRATH!!!,5,False,0
4704,"Laura (as a ghost, with cute ghost tail instead of legs) is laying on top of sleeping Keith.",5,False,0
3343,For the Halloween party a rabbit Keidran gets Mike to dress as a sly fox con-mammal to her bunny cop.,5,False,0
3790,Mama Flora suddenly has an unusual craving for sushi!,5,False,0
1919,"Masks playing poker, Neutral gets a joker (Clovis)",5,False,0
4766,Tavern master drink off: Maren vs. Adira.,5,False,0
1916,"Flora sleeping, Trace reading from a book. On the cover, in large friendly letters, ""DON'T PANIC""",5,False,0
3815,"Into Subnautica-Trace in a Seamoth, with a Reaper behind",5,False,0
9009,Madelyn and Maeve in japanese style school uniforms,5,False,0
3818,Frankenstein monster escapes her Creator and meets Raine,5,False,0
6802,Evil Trace has even turned on Nora. He battles her to the death at the Legacy Estate.,5,False,0
9008,"Captain Jenny boards a ship with her new first mate, Brutus",5,False,0
1904,Adelaide's workout routine. Natani joins in her work out & drags keith along.,5,False,0
4795,Red grabs Keidran Maren's tail!,5,False,0
9005,"Christmas morning with the gang. Flora spends the morning opening the mountain of gifts she has, only to find out every single one is just stuff for the baby. ",5,False,0
1653,Alaric incites Keith to learn black magic,5,False,0
3783,Kat giving the Lizard Guardian Statue a massage.,5,False,0
4714,Maren and Raine eat out together and enjoy some tacos,5,False,0
3788,"Natani's Magical Chest Wraps store, customers include Fem-Clovis and Shiro from Rascals",5,False,0
4858,Traitorous tail makes a return as Keith tries his hand at giving Natani a back massage.,5,False,0
8565,Karen talks with Maddie about her own private insecurities and fears while they're in the dungeons.,5,False,0
1979,Flora's history: Young Flora meets Euchre for the first time,5,False,0
3241,Maddie & Maeve on a school ball in an adorable dress,5,False,0
8689,"Natani, Zen and Youngtani as a three headed Cerberus keidran.",5,False,0
2434,Toned Keith coming back from strength & endurance training.,5,False,0
8086,"Sequel to ""Cat in the Road"": Nora wakes up amid broken shovels, chains, and wagons, wondering what caused all the chaos around her.",5,False,0
3209,Raine locked in a pillory to raise money for Zen's leg.,5,False,0
5336,Maddie and Karen pass out on the couch together after stuffing themselves during Thanksgiving.,5,False,0
6310,Nib Nab 5: Trace and Flora,5,False,0
8684,Mike finds Evals trying to flood the Patron Sketch suggestions with requests for female/Very Vixen Mikes.,5,False,0
2700,A tiger tribe witch doctor ,5,False,0
5352,"Dogs and wolf keidran recreating the famous ""dogs playing poker"" painting",5,False,0
5304,"Keith and Natani share a dance and a kiss at a Basitan party, but everyone is scandalized by their tails touching",5,False,0
7094,Human Templar Flora straddling male keidran Trace’s midsection in the hotel room scene with everyone barging in at the same time and getting the wrong impression.,5,False,0
8505,Mike meets Fem-Mike and Very Vixen Mike.,5,False,0
1722,A romantic candlelit double date dinner with Zen x Raine and Sythe x Maren,5,False,0
9043,Kathrin warns an older Maeve and Maddie about the enchanted mistletoe after they seem to just come across it.,5,False,0
5427,Adira going over the finances for the inn.,5,False,0
2429,Zen and Natani get to see their parents again,5,False,0
1228,A baby shower for Flora,5,False,0
3176,"Flora pouncing Trace, Tigger style",5,False,0
1773,Wrinry meeting Seraphina.,5,False,0
1622,Raine yells at Trace for cursing her mother. Trace tells Red she’s crazy,5,False,0
1780,"Realise a lizard tribe, suitable being adaptable in the TwoKinds universe.",5,False,0
1681,Zen as Adam Jensen from Deus Ex,5,False,0
1753,Euchre getting Raine's wedding announcement. This is the first he's heard of the event.,5,False,0
4882,"A very confused and nervous anthro-Reni somehow assumes the human throne, becoming ""Queen Reni""",5,False,0
9002,The Twokinds gang tries to put on a Living Nativity Christmas pageant but it goes horribly wrong.,5,False,0
2441,Seraphina and Princess Reni having a tender moment together.,5,False,0
2421,A hungover Red wakes up to find Sythe and Zen cuddling next to him.,5,False,0
1742,"The team is playing Uno, and one of them cheats.",5,False,0
1236,Darkest Dungeon at the Legacy Estate.,5,False,0
4843,British spy Zen interrogates/flirts with Soviet Kat who is flustered by his charms,5,False,0
3244,Flora tells Maeve & Maddie a spoopy autumn night campfire story,5,False,0
4832,Trace teaches Roselyn magic while Saria watches with a smile.,5,False,0
3226,"Kat & Raine excitedly dictating scenes from their ""friend-fictions"" for Eric to paint.",5,False,0
3230,Clovis forces Natani to choose between Zen & Keith. Kill one to save the other.,5,False,0
940,Adira and Adelaide. Adira watching over the King how she would fare working at a tavern.,5,False,0
2511,Seeing the Twokinds cast attending a convention wearing lanyards and badges.,5,False,0
9102,"The many forms of Trace: Male, Female, Tiger, Tigress, Dragon, Basitin, Demon",5,False,0
7698,Beginning of the royal dragon family. Reni's grandfather met human princess .,5,False,0
10605,Natani and Youngtani vs. Keith and FemKeith: FIGHT! ...and they're just snuggling,5,False,0
7247,Good morning Lioness Saria,5,False,0
9373,"Zen, Trace, Keith and Natani all taking an outdoor bath together. Naked.",5,False,0
10619,Portrait of Karen with an endearing smile,5,False,0
10675,The maned wolf in one of Kat's dresses,5,False,0
9522,"The whole gang in among us, where trace is the imposter",5,False,0
6337,Good morning Natani,5,False,0
9434,"Reni, in her anthro form, tries to explain to Nora that proportions affect balance. Nora responds by bwoming Reni, saying it's much more fun that way.",5,False,0
10667,Sythe reacts to Species swapped Raine and Maren,5,False,0
12050,Kat gives a reassuring hug to someone having a bad day,5,False,0
7717,Flora's daki 2020 edition,5,False,0
10673,"Reni, in her anthro form, tries to explain to Nora that proportions affect balance. Nora responds by bwoming Reni, saying it's much more fun that way.",5,False,0
6751,Fem Mike flirting on Kat,5,False,0
10649,Modern AU: Cyberpunk Raine is helping Gaming Nora to find RHGUY69,5,False,0
10650,"The Female Northern Basitin brings back her catches, and the injured wolf back to her place with the Other northern Basitins jokingly say ""Can't wait to have wolf tonight!"" The Wolf looking vary worried.",5,False,0
7667,Sexy secretary Laura,5,False,0
7233,Keith and Natani kissing at the beach while sunset and the background is the sea,5,False,0
9366,Snep daddy daki (the big snep from the holiday with the sneps sketch),5,False,0
11634,"In the ""Raised by the King"" AU, Jade treats her children to their first night of of carving jack-o-lanterns!",5,False,0
7243,"""Gamer Girl"" Nora: Cat Nora tries to ""encourage"" donations from her viewers ",5,False,0
12033,Vampire queen Raine (wolf),5,False,0
9258,Human Reni in armor fighting alongside Kei,5,False,0
7274,Maeve and Adira meet Windstraw,5,False,0
11138,"Adventures of the Potato Sack, pt 1: After sinking into the ship, the potatoes washes ashore on a distant island.",5,False,0
6700,"Trace is dealing with pregnant Flora’s cravings, by getting them personally",5,False,0
9393,Flora Daki Redux,5,False,0
7246,Angel Flora fighting an out of control Demon Tiger Trace to bring him back to his senses,5,False,0
12100,"If Natani and Zen ended up on the basitin Isles, someone has to take their place in the assassins guild, why not Keith? What better way to let out aggression towards Keidran than getting paid to do it? ",5,False,0
12097,Grand Templar Raine Silverlock,5,False,0
12096,Natani dakimakura pillow design,5,False,0
7213,good morning Tigress Trace.,5,False,0
10630,Genderbent AU: Raine confesses his transformative secret to Scarlet and Sythe (As in comics 718-720),5,False,0
11631,Lioness Saria models nude for Rose's painting,5,False,0
7204,Laura sitting in Keith’s shoulders holding his ears like reins directing him where to go,5,False,0
11632,Red has to apologize to the Chimera. He has to invite her to buy clothes with the girls,5,False,0
10657,Madelyn meets a Western version of her self. Then passes out from shock of her AU versions lack of modesty.,5,False,0
7598,Laura & Kat Roommates: Competitive Team Gaming,5,False,0
11778,"Mike, Evals, and Kat relax at the Gender Swap Spa, where patrons' bodies change upon entry.",5,False,0
10940,Tomboy Kat rock climbing with a view of the Basitin Empire. ,5,False,0
7809,Natani accidentally makes Keith the size of a doll. Natani is amused while Keith is quite upset,5,False,0
7806,"Undercover Western Maddie. Some of the patrons of the gala begin to suspect Maddie. But thinking she's otherwise harmless, they just try to have a bit of fun with her. Maddie does her best to retain her composure!",5,False,0
11833,Modern Laura finally getting her hands on the mythical PS5 console.,5,False,0
11831,"Youngtani goes to Halloween by hijacking Clovis' body as her costume, much to the princesses dismay, particularly on the outfit chosen, or lack there of.",5,False,0
7753,"Euchre as Merlin telling young Trace as Arthur ""If you think magic will solve all your problems, it won't!"" (Disney's Sword in the Stone Reference) ",5,False,0
11042,Bad guys can have Pool parties too (the Master Templars enjoy a day at the academy pool),5,False,0
11824,Kat gives a reassuring hug to someone having a bad day,5,False,0
7776,Fem-Clovis being jealous of how big and buxom Fem-Brutus is,5,False,0
12074,Kat presenting a roasted turkey for a Thanksgiving (or setting appropriate harvest festival) meal. ,5,False,0
6442,Eric finds a dangerous device: a tail-lifting remote,5,False,0
6719,FemMike in her Custom Underwear,5,False,0
9587,The Solider from Basitin Flirting learning how to properly flirt with Basitins.,5,False,0
7521,"“Lifts her Tail”, from the Elder Scrolls Lusty Argonian Maid, teaching Roselyn how to properly polish a spear.",5,False,0
11769,Natani wants paw rubs after training. Keith gets blushy,5,False,0
9590,"After Saria's death, the young Rose visits her grave to mourn her best friend",5,False,0
7558,Adult Maeve and Maddie switch species. And both of them are very surprised and shocked about it.,5,False,0
9297,chibi Nibbly ,5,False,0
7582,Cat Nora Against the Glass,5,False,0
10963,"Natani, Zen and Keith as the Spanish Inquisition from Monty Python. Nobody expects the Spanish Inquisition!",5,False,0
11623,"Demon tiger Trace 3: Trace comes to his senses, and is filled with tearful remorse after realizing he attacked his (unscathed) love, Flora, who gladly comforts him as she strokes his head in her lap.",5,False,0
9411,Modern Natani sends Keith provocative ankle pictures,5,False,0
10921,"The Trials of Scarlet - the newly floofed Keidran is going through her first ""season"", and has barricaded themselves in their bedroom. Meanwhile, Sythe tries to deliver their new clothes.",5,False,0
6619,good morning karen (viewer has been kicked out of the bed by a sleeping Karen),5,False,0
10920,"Dating Sim AU: Hoping no one noticed their transformation, VV Mike tries to rebrand as the hot transfer student.",5,False,0
6464,"Good Morning Natani, except Natani is much less graceful in the morning than the others.",5,False,0
7670,Saria finds Rose's habit of going without clothes distracting and begs her to put something on while she works. ,5,False,0
11613,Good morning Brutus,5,False,0
7689,"Good morning, FemAlaric!",5,False,0
12064,"Natani wearing Krystal's skimpy tribal outfit, surprised at how comfortable it is to fight in. Keith seems to enjoy it too... (tail katana)",5,False,0
9494,Raine (halfkind) and Red are building snow-sneps in the garden! ,5,False,0
9493,Keith and Natani roleplaying as maid and master. Keith is the maid,5,False,0
10894,2009 bath time flora redux,5,False,0
11050,Nora and Reni: Cat and Mouse (Tom and Jerry) Parody Housecat Nora is trying to catch a Mouse Reni.,5,False,0
7795,"While exploring a cavern, dragon Reni accidentally discovers a tribe of kobolds",5,False,0
11805,"TwoKinds High: meet Reni (dragon) as she tries out for cheerleading. She looks cute in the outfit, especially the skirt, but isn’t terribly graceful. How embarrassing!",5,False,0
9542,Christmas Miracle part 2: Kat and Zen announce Kay’s pregnancy to Keith and Natani,5,False,0
7111,Flora gives in to her strange cravings and orders magical room service with the summoning table: baby wants chocolate!,5,False,0
7258,Flora as Tigress from Kung Fu Panda,5,False,0
9167,Raine wearing a Christmas Outfit.,5,False,0
11249,Reni toasting marshmallows.,5,False,0
11371,AU: Tom‘s Pizza Delivery Redrawing of page 68 but instead of absolute chaos the characters (including Tom) enjoy a nice large pizza with extra anch-,5,False,0
11081,In the modern AU:  Zen and Nat are racing each other on 4 wheel ATVs with Kat and Keith hanging on for dear life.,5,False,0
11254,Professor Raine teaches the biological differences of Mekkan's species.,5,False,0
9751,"Modern au, Zen and Kat fall asleep together on the couch while watching a movie ",5,False,0
11354,Keith with striped thigh high socks and elbow gloves.,5,False,0
9200,Kat and Zen build a snowman and discover that using mana crystals gives it life,5,False,0
11516,"Karen and Maddie running a little Cafe, and within 5 seconds of opening something catches fire.",5,False,0
7268,"Preparing for the Saria and Trace wedding, Saria asks Rose to be her bridesmaid. Rose doubts this is a good idea but Saria convinces her.",5,False,0
11088,"TK main four as the Vault Hunters from Borderlands 3 (Flora as Moze, Trace as Fl4k, Keith as Zane, Natani as Amara)",5,False,0
9173,"Maddie and Maeve on their next Splinter Cell OP, ""Operation Sneak Peek"" Their mission, to gather intel on their Christmas presents. ",5,False,0
6450,"Magic gone wrong: Seraphina has become human, and Sealeen and Landen are Adrakists!",5,False,0
7461,Ghost Laura dives into Keith and plays around in control of the flustered Basitin's body,5,False,0
11548,Sequel to Body Swap - Raine and Kat and Measuring Up. Kat is glad that now she can measure her body better than from the first person.,5,False,0
11547,Lioness Saria models nude for Rose's painting.,5,False,0
11544,"Pirate Queen Jenny posing for an ad for Western Basitin Rum. She has one foot on a short keg, leaning slightly on that leg and her cutlass at shoulder arms.",5,False,0
9708,Redraw of old character concept: Stilt Wolf,5,False,0
6677,"An angry Raine (Half-kind form) shouts at her parents for neglecting and abandoning her, declaring that she's proud of who she is-human, half-kind and keidran.",5,False,0
11340,Sythe and Maren reenacting the ballroom scene from Beauty and the Beast.,5,False,0
11187,"Magical Mishaps - To Catch a Thief - Evals has been stealing from Eric's stash of booze he accidentally pours a spiked bottle of liquor for himself and Mike, turning them into girls.",5,False,0
9671,Kat and Zen kissing in a shower,5,False,0
9798,Mike meets Krystal from Star Fox,5,False,0
7353,Angel Flora fighting an out of control Demon Tiger Trace to bring him back to his senses,5,False,0
9675,"Eric tries to get human Kat to cover up in public, but she resists because she doesn't see what the big deal is (Sequel to Human Kat - Casual Streaking)",5,False,0
11685,"Young Reni trick or treating as a bat, hanging upside down from someone's porch roof.",5,False,0
7343,Maeve mimics her mother’s tavern portrait ,5,False,0
11663,Natani dakimakura pillow design,5,False,0
11201,“Pinned ya” but from Natanis POV ( they could be looking down at Keith) ,5,False,0
7365,Good morning FemMike,5,False,0
11214,"Zen and Raine, sitting on a hood of a car in a drive in theater. Sharing a tub of popcorn, and watching a cheesy monster movie.",5,False,0
9687,Kei finds the fanfic much to Raine and Reni's horror. ,5,False,0
7308,Natani getting cuddled between Keith and FemKeith,5,False,0
11184,Wolf Raine is harassed by a group of wolf-hating humans until Red comes to her defense. Raine is touched and Sythe in disbelief.,5,False,0
9733,Flora decides to test Stoney to see if he'll make a good companion for her baby when it's born. She likes him! Good boy!,5,False,0
11122,"Sequel to Wolf Mary: young Mary Silverlock gets caught by another Templar in her Keidran transformation while disrobed and feeling her fur. Not being recognized and mistaken for an actual Keidran, Mary's kicked out before she can explain, left without clothes and unable to change back.",5,False,0
9760,"Coming upon Clovis unexpectedly, Natani casts the first thing that comes to mind. Heart's Desire. Clovis is defeated after he cannot give up Brutus a second time...",5,False,0
6356,"After Trace is finished with the realism glasses, Keith puts them on and looks at Laura.",5,False,0
11536,"Sketch Idea: Rose captured in a dungeon, after being betrayed by Euchre in Chapter 16",5,False,0
12021,Sythe and Nibbly as Doomguy and his pet rabbit Daisy (alive),5,False,0
9512,VV Mike and Kat going on a date,5,False,0
6702,Nora 'begrudgingly' takes Zen and human Raine up above the clouds so they can watch the star filled nights sky.,5,False,0
9153,Flora Daki,5,False,0
12009,White Tigress Adelaide,5,False,0
9155,"Very happy Seraphine in dragon form as gift from Lady Nora to Christmas (Seraphine wang her tail very quickly)""",5,False,0
7114,Teen Maeve cuddling up to Maddie,5,False,0
6646,"Hula dancing Reni in dragon form. Keiren is amused, but appreciates the effort, to Reni's embarrassment.",5,False,0
7135,Transformation lapse of Raine ,5,False,0
11959,"Adelaide vs Natani. Expectation: A badass duel with magic and explosions and lasers and stuff and it's super cool! Reality: Natani gets absolutely bodied by Adelaide, no contest.",5,False,0
7153,Keith and Natani stargazing on a hill,5,False,0
10709,"Kathrin asks Flora for advice on dating humans. She grabs Flora by the shoulders and attempts the smug look. ""You think this will work on Eric?""",5,False,0
9119,"The cast of Twokinds doing the Peanuts Christmas Dance from ""Merry Christmas Charlie Brown""",5,False,0
11280,femSythe & femZen: waking up together the morning after Gender Flip Flirting,5,False,0
7143,Young Mike helping Evals get used to the slave collar.,5,False,0
11130,"Very Vixen, Very Foxy Mike",5,False,0
9148,The biological differences of Mekkan's main (and Windstraw's) species.,5,False,0
9085,"Hatchling Reni in a mall, asking Santa for some magical artifacts / toys.",5,False,0
6687,"Mike kisses Kat, he boldly defies an otherwise boring ""Mike x Kat"" suggestion to do it.",5,False,0
6421,"Flora, Kat and Human Reni learning hula dancing from a south-seas(western) Bastin",5,False,0
7400,Samurai Keith vs Samurai Aleric under cherry blossom trees,5,False,0
9234,Trace Putting his tattoo in the morning.,5,False,0
