,name,votes,winner,win_difference
0,Flora mid human transformation,6,False,0
3631,Keith's turn to get dragon-ified. Laura & Natani enjoy the results.,6,False,0
7358,Reni accidentally makes Lt. Reed a Lynx Keidran while Keiren struggles to fight back his laughter.,6,False,0
1242,Rick and Morty: Rick needs to steal the flawless Mana Crystal from Clovis for one of his experiments.,6,False,0
12109,Zen moon's Clovis,6,False,0
1783,Saria's ghost returns to gossip with Flora about Trace,6,False,0
8401,"Twokinds History Illustrated: Sythe's first summer living in a human village, as he described in page 828.",6,False,0
7943,Nora taking a bath in a chocolate fondue fountain. Marshmallows on the side.,6,False,0
1814,Duel between “Pegleg” Zen and diplomat Sythe.,6,False,0
7073,"Raine going through the collar training in full wolf form, sitting in a cute begging pose, flustered.",6,False,0
6303,"Magic gone wrong: Seraphina has become human, and Sealeen and Landen are Adrakists!",6,False,0
9765,The Quiet Mekkan.  Laura wakes up on the beach to a deserted world.,6,False,0
9044,Wolf Watchers (Sequel to Peeping Squirrel) - Zen and Sythe attract a small crowd to secretly watch them bathe in the nude,6,False,0
1948,Wolf Red’s primal instincts kick in & he chases his tail,6,False,0
7338,Natani getting cuddled between Keith and FemKeith,6,False,0
3911,Adira cradling baby Maeve shortly after giving birth,6,False,0
1973,Nora & Reni doing an air show,6,False,0
3763,Snowball Fight 2: Reni tries to save Kei from the snowball turned runaway snowboulder,6,False,0
3547,Indiana Raine whipping a crossbow out a guards hand.,6,False,0
3544,Frankenstein monster escapes her creator and meets Raine,6,False,0
6785,Good Morning Tigress Trace,6,False,0
2898,"Nora messes w/ Clovis some more, making an illusion of the daughter from his nightmare",6,False,0
3666,Guy-to-girl night 3: The door to the bar opens to reveal Raine’s “friend” turns out to just be little ol' Nibbly.,6,False,0
3669,"Embarrassed Keith in a cute christmas dress, much to Natani's amusement.",6,False,0
9456,Literally seconds before it all began: Grand Templar Trace tinkering with magic. An assistant warns him it could result in accidental memory loss and random teleportation. But that won't happen... right? ,6,False,0
9458,"Nibbly realizes what's going on between Maren and Sythe, now Nibbly tries get between them and stop them from engaging in an intimate moment.",6,False,0
3678,Reni receives a magical artifact as a Christmas gift from Kei but it turns out to be a dud. ,6,False,0
3685,"Madelyn, Maeve, and Karen all having a girls night out.",6,False,0
3640,"Natani opens a gift containing some very small, frilly, lacy, clothing. Keith swears its a mistake! (It's not)",6,False,0
2903,"Backside comparison, sythe & zen w/ Nibbly as judge.",6,False,0
2899,Maren & Raine express their true feelings for one another,6,False,0
3730,How Alabaster Stole Christmas,6,False,0
1876,Flora as a WWII ace next to a P-51 w/ the flying tiger mouth style finish on the nose.,6,False,0
2886,Flora as a living plush,6,False,0
3691,"More of Eric's Twokinds: Alaric's back, and has his eyes on gender bent Keith",6,False,0
6846,West Basitin Kat & West Basitin FemKeith aggressively painting each other's bodies,6,False,0
1262,Group A as a party from Darkest Dungeon,6,False,0
11120,Modern AU: Laura helping a spooked Kat beat a horror game late at night,6,False,0
11119,"Thomas the Tank Engine version of characters.  Trace the tank engine, Zen and Red as troublesome trucks, and Natani the helicopter.",6,False,0
188,Alaric,6,False,0
1835,Nibbly rocking out to some metal. \m/,6,False,0
3578,"Kat in a Trooper uniform from Starship Troopers, standing at attention & saying ""I'm doing my part!""",6,False,0
9696,TwoKids: Young Trace and Kid Keith frolic outdoors with Kitten Flora and Puptani.,6,False,0
2327,Return of the Main Character from Halfkind: Tom's pre-comic before Twokinds,6,False,0
6477,Flora and kathrin as living plushes ,6,False,0
9877,Mafia Nat and Zen are ordered to perform a hit on Keith (Member of Flora and Trace's gang) but things don't go as planned,6,False,0
9433,Good news! Clovis found a way to make Sam a Keidran again! Less good news! He's still a cow... and a she.,6,False,0
6512,The Templars attack the Tiger village and the explorers must defend their new home - but are they equally committed?,6,False,0
3968,Kat drawn as Eevee and Flora drawn as Pikachu from Let's Go Pokemon,6,False,0
11842,Modern AU Reni and Chimera hanging out at a cafe,6,False,0
7909,Natani and Keith sit in front of the burning fireplace in a log cabin in a snow-covered coniferous forest in Canada. Natani has her head on Keith's shoulder.,6,False,0
9984,Zen and Kat are running away from a angry snowman that came to life after they used mana crystals as decoration.,6,False,0
11830,Kris and Susie from Deltarune fell into the Twokinds world,6,False,0
10021,Good Morning Mike (male),6,False,0
10017,Cute Demon. Shadow Nibbs in anthro form.,6,False,0
8201,"Kat shows off a new custom swimsuit conveniently framed by the beach, encouraged at Eric’s seemingly overly enthusiastic reaction, not realizing the reason for his excitement is the 100 foot wave behind her rushing to shore",6,False,0
9978,Zen Daki,6,False,0
9946,Keith and Alaric’s duel in the style of a cheesy wild west standoff,6,False,0
399,"Pixie Panic aftermath 2: Mike & Evals, all dolled up.",6,False,0
3945,Clovis is sold to Eric who needed a new vixen to model for his art. He loses his temper due to Eric's directions.,6,False,0
4009,"Natani's Magical Chest Wraps store, customers include Fem-Clovis and Shiro from Rascals",6,False,0
4013,"Kat designs some clothes for Magpie that actually fit, and tries on Magpies outfit herself",6,False,0
9957,"Young Nora, naïve on intimacy, tries acting seductive but trips, with her 1st mate asking if she’s OK, offering to help her up.",6,False,0
9353,"Couple retreat: Keith and Nat shocked to see King Jade on the island with her new ""boyfriend"" ( A Male dragon held against his will by King) Maddie not sure how to react.",6,False,0
7550,Laura possesses Keith and plays around in his body as he gets flustered.,6,False,0
9283,Modern AU: Keith takes Laura to the gun range to test her gamer FPS skills.,6,False,0
10459,Ghost Laura and Brutus cheering on Kat and Rom as they fight,6,False,0
11910,White Tigress Adelaide ,6,False,0
7649,Good Morning Adelaide...except she's embarrass cause she can't fit your human size bed.,6,False,0
4061,"A ""Nora's Victim Support Group"" informational pamphlet (have YOU been transformed the mischievous Lady Nora?)",6,False,0
9854,Willow daki,6,False,0
9381,Viking Maeve ,6,False,0
9383,"Windstraw enters a drinking competition to help the bar get more visitors, but gets drunk after one shot.",6,False,0
4027,"Mike's a lucky fox this valentines day, thanks to Nora working her magic on Evalyn",6,False,0
10194,Keith and Natani cuddling in bed,6,False,0
317,What would we get if we but Kathrin and Zen go for a date?,6,False,0
10123,Kat as a sexy femme fatale noir character… but it turns out shes's just fantasizing about the book she's reading,6,False,0
8974,"Clovis Scrooge is visited by Laura, Brutus, and Nibbs as the Ghosts of Christmas Past, Present, and Future.",6,False,0
7740,"Euchre as Merlin telling a young Trace as Arthur “If you think magic will solve all your problems, it won’t!” (Disney’s Sword in the Stone reference)",6,False,0
6323,The Solider from Basitin Flirting learning how to properly flirt with a Basitin.,6,False,0
4097,Karen finally gets to fondle Basitin ears after transforming Kat with magic ankle wraps.,6,False,0
10149,"Flora gets a case of the zoomies in the middle of the night and as a result, Trace looks like he hasn't slept in days. ",6,False,0
4076,"Sequel to Binding Bargain. Clovis tries to use magical bandages, but Nora’s curse doesn't let him/her do it.",6,False,0
7768,Portrait of Cat Nora (Cat Nora still shows her beauty in her portrait),6,False,0
323,"""Bad pillow"" Raine is sleeping on Maren and Karen is sleeping on Raine's tail. According to page 968.",6,False,0
4087,Captain Raine makes Clovis walk the plank.,6,False,0
9367,"The main four as survivors on a deserted island. Trace is cooking fish and burning it, Keith is trying to catch fish while Flora attaches the fishing hook to his pants without him knowing, and Natani is trying to murder a shark that tore off his chest bindings.",6,False,0
8231,"With the power out in their apartment, Zen and Raine light some candles and spend the time playing board games.",6,False,0
9915,Human version of Flora's Sister Ivy,6,False,0
9910,Half-keidran Raine meets human Holo from the “Spice and Wolf”.,6,False,0
9400,Twokinds High: Mike is mistakenly issued a girls' uniform.,6,False,0
9928,"Mike kisses Evals who is reluctant at first, but then gets more into it (both male)",6,False,0
3979,Mike laughing at Fem-Fox-Keith for his “basitin black magic” backfiring on him,6,False,0
380,Prom Queen Mike & Prom King Evals,6,False,0
7539,The older Maeve in evening dress,6,False,0
10502,Kathrin summons Sealeen's Love Potion to save herself from Romulus.,6,False,0
4158,The mains as characters of world of warcraft ,6,False,0
10220,Good morning Zen,6,False,0
9310,Keith had a little too much of the good stuff at the annual New Years party and accidentally stumbles into the wrong Magi Brother's bed.,6,False,0
4131,"Keidran Nibbly gets a tummy ache, Sythe comforts her with a belly rub.",6,False,0
4136,World War II sexy pinup of Adelaide Admiral of the Royal Navy riding the bow of the HMS Victorious into battle.,6,False,0
10251,Ice mage Wolf Raine and lightning mage Maren,6,False,0
6438,Grand Templar Laura and the Slaver Sisters  Kathrin and Flora have tea when Laura takes notice of a special Basitin slave boy,6,False,0
10373,"Clovis' minion Sam uses a Collar of Keidranification to make himself Keidran again. Unfortunately, he's still a cow... and a she.",6,False,0
10370,"Beach party! Lynn insists Keith must wear a Victorian swimsuit, for modesty.",6,False,0
4168,Flora’s Extended reaction to Trace being called papa: Attempt at Motherhood,6,False,0
7641,Portrait of Cat Nora (Cat Nora still shows her beauty in her portrait),6,False,0
10405,Nibbly in messing with the voting system,6,False,0
4201,"Older Maddie finally hits a growth spurt and surpasses Adelaide's height, much to Maeve's surprise",6,False,0
226,"Flora in the virgin killer sweater, saying: “…my butt’s cold…” ",6,False,0
4175,"Halo Raine 2 - Raine trains with the Master Chief, while RED chats with Cortana. (Human form).",6,False,0
10393,A Dragons/Dragonesses talk with Nat and Flora about how they met their significant other.,6,False,0
10342,"Trace, Flora, and Flora's parents dressed up as the Boyfriend, Girlfriend, and her parents in 'Friday Night Funkin'",6,False,0
10333,"As Explorer Brin and her new Snep hubby prepare to leave, the villagers present her with a parting gift - an honorary (replica) Snep tail, to mark her as an official member of the tribe!",6,False,0
10331,(Actor AU) A peek into the life of Keith and Natani's actors,6,False,0
7606,Originally plain cat keidran Flora,6,False,0
10347,Kat and Flora Living plush,6,False,0
11763,"Genderswap AU: The gang arrives at the Legacy Estate in Edinmire, only to be greeted by male Rose and...a child?! As it turns out, since Trace was the one who was pregnant, not the now-deceased Saria, she was able to safely deliver the child, and they've been waiting for their mom to come back.",6,False,0
7621,Maddie has dressed up in Keith’s general outfit and is caught pretending to be him. ,6,False,0
9345,A dentist's nightmare. Dragon comes in for dental check-up,6,False,0
10523,A redraw of the last panel of page 223. (Badass demon dragon),6,False,0
10417,Zen and Kathrin turned into Nagas due to a magic accident.,6,False,0
7486,Merfolk Raine peacefully sits on the rocks of a calm lagoon,6,False,0
4241,Origami Nibbly.,6,False,0
357,"Steampunk crossover. The great Templar Trace, fighting with the evil mechanic Ephemural.",6,False,0
9260,"Wolf Raine wearing short tight shorts and top, giving her most sensuous pose and wishing happy new year to fans.",6,False,0
8264,Airport security sequel: Willow has finally managed to convince security that the lamp is actually her. Unfortunately this means that her lamp must occupy the seat and her vessel has to be put in the overhead baggage as a carry on,6,False,0
7505,Angel Flora fighting an out of control Demon Tiger Trace to bring him back to his senses,6,False,0
10581,Trace and Flora watching the sunset at the beach.,6,False,0
9273,Little Red Riding Hood Maren meets the bad wolf Sythe on the way to her grandmother,6,False,0
10518,Kat relaxing time. Make and Evals helping her by fan and giving paw massages ,6,False,0
10300,Maren decides that she and Trace need to hash out their unresolved issues by a traditional but obscure method: dragon jousting. She drags Reni and Nora in as seconds/mounts.,6,False,0
7581,Clovis trying to keep Brutus from leaving the room accidentally...tugs...his tail! ,6,False,0
11766,"Succubus Maren gives her victim Sythe the choice of what to play with him, Trick or Treat",6,False,0
4306,Alaric and Keith’s nude beach vacation ,6,False,0
4287,"Eric ""studies"" Chimera to see what kind of Keidran she actually is, and he also adds a new painting to his collection",6,False,0
10286,Natani and Keith cuddling,6,False,0
7650,Flora gives in to her pregnancy cravings and orders magical room service from the summoning table: baby wants chocolate!,6,False,0
4268,WWII: Tigress Trace wearing a US Army Air Force uniform while sitting on the wings of the P-40,6,False,0
9337,The Twokinds High visual novel also has a VV Mike secret route,6,False,0
9339,Saria and Rose wake up after a wild New Year's party and wonder if anything happened between them. ,6,False,0
11797,"Templar Laura AU: Keith returns home, at the head of a Templar fleet sent to siege the Isles",6,False,0
11897,Young Raine and Reni collaborate to steal the Thanksgiving turkey.  Fortunately someone's parents cooked more than one.,6,False,0
3532,Thanksgiving with the two kinds group,6,False,0
6370,"In preparation for their first date together, Trace and Saria seek advice from their friends. Trace from Nora, and Saria from Rose. ",6,False,0
9027,The biological differences of Mekkan's main species (and Windstraw's),6,False,0
9240,Good morning Mike (male),6,False,0
7856,Tiger Trace sleeping on Flora's chest,6,False,0
8946,Human Flora & Kat wearing their keidran onesies,6,False,0
4467,Gender switch; Trace as a female and Flora as a male,6,False,0
4481,Kat is the bard to a group of adventurers.,6,False,0
2031,Mike & Evals trying to relax at the mansion unaccustomed to being guests.,6,False,0
2030,Alaric & Madelyn are fencing/sparring. Madelyn is impossible to land a hit on.,6,False,0
7876,"Brutus, hearing ""Let me in"" Clovis, opens the gate a bit too quick slamming Clovis between it and the fence.",6,False,0
69,Trace & Eric Money Fight!,6,False,0
4357,Maddie chugs down a mug of Landen's coffee (extra strong) and becomes so hyper she starts moving faster than a hummingbird.,6,False,0
4340,King Adelaide gives dating advice to her daughter,6,False,0
71,Keith meet Alaric for the first time. Something from their early childhood or first training days,6,False,0
2067,"Dust: An Elysian Tail, Dust accidentally turned into a Nimbat by Fidget.",6,False,0
9215,"Raine and Red get caught under the mistletoe. Raine gets flustered, goes halfkind, theres blushing and cute awkwardness.",6,False,0
7005,Laura against the glass,6,False,0
1362,"""Keiser Odyssey"" Keith is dressed as Mario and the bucket helmet is possessed by Laura.",6,False,0
9040,"The many forms of Trace: Male, Female, Tiger, Tigress, Dragon, Basitin, Demon",6,False,0
7872,Originally plain cat keidran Flora,6,False,0
4390,"Keith, Alaric, and Basitin Trace drink way too much on St. Patrick's Day",6,False,0
4395,Flora Reference Sheet,6,False,0
2310,Keith makes peace with his father at his grave site ,6,False,0
2318,Non-genderbent Mike & Evals trying on dresses together.,6,False,0
10059,Remus wearing the cone of shame after his run in with nibs,6,False,0
61,Mrs. Nibbly dressed like Yoda,6,False,0
10338,After listening intently to Raine about everything there is to know about dragons Maeve shares the new knowledge with friends!,6,False,0
2180,Keith finds himself comfortably in bed between sleeping Flora and tiger Trace.,6,False,0
2178,"Modern-day style Keith & Natani sharing an umbrella in the rain, holding hands.",6,False,0
2196,Witcher Keith fights Nora,6,False,0
2217,A look at Adelaide & Natani's conversation discussing Natani's Secret after page 592,6,False,0
3372,"UNSC Spartan Raine-Human Raine as a Spartan 4 from Halo, w/ Red as her Artificial Intelligence.",6,False,0
12070,Male Mike daki,6,False,0
9195,"Hatchling Reni in a mall, asking Santa for some magical artifacts / toys.",6,False,0
7984,Natani uncharacteristically dancing with Keith at a rave or club.,6,False,0
2328,Mike & Evals learn from Natani how to be DEADLY ASSASSINS,6,False,0
3132,"Zen & Kat in an intimate embrace, overlooking a nighttime skyline of a modern city.",6,False,0
3422,"Clovis is Rita Repulsa, & its time to conquer Earth!",6,False,0
9205,"Zen and Human Raine all bundled up in a blanket, sitting by window overlooking a snowy cityscape. Opening the gifts they got for each other.",6,False,0
3397,Redraw: Keidran Trace 'Sit',6,False,0
6971,Natani and Keith Family Portrait,6,False,0
3410,Frankenstein monster escapes her Creator & meets Raine,6,False,0
7286,"Mischievous schoolboy Keith is sent to detention with Ms. Laura.  Unfortunately (or fortunately) for him, corporal punishment is still allowed! ",6,False,0
4415,"Jedi Trace battles his dark sides-Black Mana and Templar Trace-in an epic 2v1 lightsaber battle, with both Sith Traces using crossguard lightsabers.",6,False,0
7277,"Natani as Tifa, Laura as Aerith and Keith as Cloud from Don Corneo’s bride scene from Final Fantasy VII Remake.",6,False,0
8950,Trace finds out Nora has been streaking this whole time turns out dragons normally are modest like Reni ,6,False,0
4420,Continuation of Eric's “New” Twokind's : Alaric's Return strokes the fires of Basitin passion! co-written by Kathrin Vaughan,6,False,0
4371,"Trace reveals his transcendent magic potential. Lady Nora is amazed and impressed, he is not just another eye candy anymore. ",6,False,0
7020,Undercover Western Basitin Maddie abuses her adorableness while on duty to get invited/invite herself to a Western Basitin feast and gala. ,6,False,0
7714,"Puppy Brutus, proudly marching around on all 4s with a stick in his mouth",6,False,0
9091,Half-keidran Raine meets human Holo from the “Spice and Wolf”.,6,False,0
4544,WWII: Tigress Trace in a US Army Uniform being painted on the plane of the P-40,6,False,0
11806,"Oh no! It's the rare occurrence of the weretiger trace, all floofed up for Halloween!",6,False,0
9141,"As VV Mike is getting out of bed, Kathrin gives her a big adorable hug from behind!",6,False,0
346,Ms. Nibbly sleeping on Karens face like a kitten,6,False,0
9146,Santa Kat gets stuck trying to slide down a chimney to deliver presents.,6,False,0
7679,"While Natani is dumping her stash of mana gems from her bindings, Maddie plops out.",6,False,0
2111,Keith as Ratchet from Ratchet & Clank game series.,6,False,0
8343,Evals goes to see mike but finds very vixen mike changing clothes,6,False,0
4593,"Sequel to ""Let Sleeping Dragons Lie"". Trace complains that dragons are too heavy and asks Nora not to sleep on him. Nora solves this by taking human form.",6,False,0
348,"""Keith's Assistant"" Trace turns into a Basitin",6,False,0
10109,"It is mentioned in King Adelaide's reference sheet that she enjoys sailing as a hobby, so she meets Captain Jenny and they go on an ocean expedition together!",6,False,0
7838,"With the power out in their apartment. Zen and Raine light some candles, and spend the night playing board games.",6,False,0
349,"Flora builds pillow fort/cave curled up in it, with demonic eyes staring at Trace",6,False,0
10074,Kat and Evals watch in utter confusion and shock as Mike is running away in terror from an Easter Bunny who just wants to give Mike an Easter Egg.,6,False,0
6398,"Keith presents his new armor invention: ear helmets, to protect against further harm and surprise grabs.",6,False,0
4559,Vixen Raine,6,False,0
1293,"Wrinry finally wears some clothes, much to her annoyance.",6,False,0
8338,Trace and past Trace as twins at the Templar school for magic attempting to impress Head mistress Nora. ,6,False,0
9128,"Roselyn, using teleportation magic, scares Trace.",6,False,0
4058,Madelyn & Karen vs. Flora & Kathryn: Beach Volleyball,6,False,0
10062,"The bunny girl offers up Mike some ""Easter eggs"" by painting her chest to look like a pair of them.",6,False,0
7673,Zen and Kathrin are looking at the stars on a hill in a beautiful night.,6,False,0
4537,Maeve buries Keith and Natani’s legs at the beach and fashions Merfolk tails over them.,6,False,0
7656,Flora meets Tigger and tries to bounce on her tail like him,6,False,0
4641,"Nibbly as an Adrakist, learning to fly.",6,False,0
4372,Trace and Flora enact the balcony scene from Romeo and Juliet,6,False,0
7716,Laura possesses Keith. Keith becomes flustered as his body begins moving on its own.,6,False,0
2020,Raine as Elsa from frozen,6,False,0
8357,"Romulus and Remus put on a show at their previous job as the main act in a Magic Mike/Chippendales-style exotic dance club. Clovis was just in the audience to scout potential new bodyguards, he swears!",6,False,0
2013,Princess Clovis poses for her official portrait.,6,False,0
4507,"Her painting of Fox Eric complete, Flora removes the collar of keidranification before he has a chance to put some clothes on",6,False,0
2005,Adrakist Flora dancing in sunbeams.,6,False,0
4635,FemKeith uses her chest bandages to banish Keith to the pocket dimension.,6,False,0
2141,Adira & Maeve entering the Legacy Manor for the first time.,6,False,0
4644,Grand Templar Trace commissions local artist Eric Vaughan to paint his portrait,6,False,0
6340,"An emotional moment. Kathrin hugging Zen, trying to cheer him up.",6,False,0
4646,Raine with short hair.,6,False,0
9087,"Cyberpunk Raine returns as a Nomad from Cyberpunk 2077, driving her car with the viewer in the passenger seat",6,False,0
4613,Natani (somehow) teaches trace how to fight,6,False,0
4622,"The bunnies, wanting to keep him around a little longer, dress Mike up as the central figure in their spring, treats giving celebration (Easter Bunny).",6,False,0
4684,"Raine and Zen's snapshot at the top of a rollercoaster. One is freaking out trying to hold on to the other, while the other chuckles and tries to  comfort them.",6,False,0
1337,The Life-binder Alexstrasza (WoW) gives blessing to pregnant Flora,6,False,0
2161,Keith's reaction to Natani in a dress from The Dragon Masquerade.,6,False,0
2160,"Keith as Knight Artorias from Dark Souls, & puppy Natani as Great Wolf Sif.",6,False,0
2157,Sealeen dressed up & lookin' pretty.,6,False,0
6879,Trace and Flora as The Rising of the shield hero ,6,False,0
248,Older Madelyn and Keith enjoying a romantic dinner together in front of a fireplace. On the mantle is an urn with Natani's mana crystal necklace draped around it.,6,False,0
4758,Love Zap part 2: Flora’s zap backfired and makes her all floofy and puffball-like,6,False,0
1129,Laura and Keith dancing in the rain,6,False,0
2381,"Therie, Natani and Flora sharing tips on relationships. With Kathrin spying on them.",6,False,0
4744,World War II pin-up Maren as sexy French Maquis Resistance freedom fighter,6,False,0
595,"Full Metal Alchemist crossover. Trace as Edward, Keith as Alphonse, Flora as Winry.",6,False,0
11531,Young Nora visiting the early human settlement. Unfamiliar scents cause her to sneeze and accidentally burn down the entire village.,6,False,0
11533,"Twokinds High 5 Sequel: Hoping no one noticed their transformation, VV Mike tries to rebrand as the hot transfer student.",6,False,0
4724,Mike doing the fox dive into snow.,6,False,0
2392,Maddie used the gate key to check on her own home.,6,False,0
680,"Flora finds the TARDIS, whilst walking in the woods with Trace. Flora is curious while Trace is cautious.",6,False,0
8572,Pirates of the Caribbean: Captain Flora and her secrets,6,False,0
1119,Halloween at the Legacy Estate: Roselyn hands out candy to trick or treaters,6,False,0
701,Keith proposing to Laura,6,False,0
2398,Seraphina in Sienna's Unchained outfit from Warhammer: Vermintide 2,6,False,0
690,Raine in a wedding dress.,6,False,0
1130,A female flying fox keidran for Halloween. ,6,False,0
8581,Mike catches Evals trying to flood the Patreon sketch submissions with 'more female/very vixen Mike' suggestions.,6,False,0
4734,"Flora has taken command of Eric's ship and gone full pirate queen, giving orders to a confused first mate Kat. Avast!",6,False,0
4864,Redraw of Kat’s first appearance in the comic from page 274 to celebrate 13 years since she was introduced! (July 2006 - July 2019),6,False,0
2465,Mermay Carver: Raine's teleport places him among merfolk,6,False,0
1168,Kat and Flora at a Halloween costume party with a steampunk theme.,6,False,0
8885,"Brutus, hearing ""Let me in"" Clovis, opens the gate a bit too quick slamming Clovis between it and the fence.",6,False,0
11667,"Cerberus Natani, the three heads are Natani's three aspects, Fem Natani, Male Natani, and Youngtani.",6,False,0
8831,"Twokinds Anatomy Lesson on Skeletons: A look at the differences between Human, Tiger, Wolf, and Basitin skeletons. Trace, Flora, Natani, and Keith are attending.",6,False,0
2420,Raine transforms in her sleep while having a nightmare and her clothes stretch out,6,False,0
1420,Saria's ghost returns to gossip with Flora about Trace.,6,False,0
