,name,votes,winner,win_difference
8405,"Brutus somehow runs into Fem Brutus! ""Whoa! I didn't know I had a Brother/Sister!"" They of course get along swimmingly. ",5,False,0
536,"Original tuxedo cat Flora meets tiger Flora, who is upset that her chest size wasn't redesigned as well.",5,False,0
979,Flora becomes frustrated of Tigress Trace's bigger breast size ,5,False,0
4002,Keith naked with a gift box on his crotch beckoning Natani to come unwrap her present,5,False,0
4597,"Raine and Red as Dianna (or Kessah, short haired Raine?) and Adrien from Hunters of Salamanstra.",5,False,0
813,Eric gets to draw Merie the mermaid,5,False,0
10483,Ice mage Wolf Raine and lightning mage Maren,5,False,0
481,"""Team A group hug"" Trace, Flora, Keith, and Natani show each other some love after CH 18's events.",5,False,0
9873,"Choosing the ""flirt"" option when you meet Sahari, the sphinx in the maze ",5,False,0
8914,Sequel to Humans Nora and Reni: Nora checks out the transformation work on Reni's backside and approves.,5,False,0
10415,The first time Trace and Flora meet but Flora is a wolf instead of a tiger,5,False,0
8768,"Sequel to Mindreading Raine. Still in Nora’s dreamscape, Raine finds Nora’s secret fantasies of finally seducing Trace.",5,False,0
3966,Keith begrudgingly accepts that he’s the little spoon,5,False,0
487,Human Flora and Keidran Trace doing cute couples stuff?? Or some type of role swap between them?,5,False,0
271,Alaric and Keith sparring together ,5,False,0
8931,Roselyn using teleportation magic scares Trace.,5,False,0
871,"Older Madelyn and Keith enjoying a romantic dinner together in front of a fireplace. At their heels, a sleeping toddler basitin.",5,False,0
8772,Literally Vixen Laura,5,False,0
4024,Dragon Nora posing for Eric's portrait.,5,False,0
10450,Modern AU: Flora and Ivy have a sister spa day by getting a pawdicure!,5,False,0
10444,Just desserts - Remus and Romulus suffer the same punishment as Clovis did at the end of Dragon Masquerade.,5,False,0
8902,Modern AU: Maeve helps Adira in the Squirrelmart.,5,False,0
4094,"Eric ""studies"" Chimera to see what kind of Kiedran she actually is, and he also adds a new painting to his collection",5,False,0
1090,"Alternate ending: Older Maeve remembering her mother, who sacrificed herself to save her life during the wolf invasion.",5,False,0
9926,TwoKids: Young Trace and Kid Keith frolic with Kitten Flora and Puptani.,5,False,0
288,Wrinry getting her wings back,5,False,0
4091,"Flora and Trace cosplaying as Star Wars: KOTOR characters, Trace as Revan and Flora as Bastilla Shan",5,False,0
282,Wrinry getting her wings back.,5,False,0
10574,"Reni, in her anthro form, tries to explain to Nora that proportions affect balance. Nora responds by bwoming Reni, saying it's much more fun that way.",5,False,0
576,"Fl'oreal, Like L'oreal the hair product but with Flora instead",5,False,0
302,Maeve riding piggy-back with Adira,5,False,0
4078,"Twokinds Sims - with Trace, Flora, Keith and Natani as sims and Tom as the player, making them do things they hate (like cleaning, cooking or making out with a wrong person)",5,False,0
4077,Trace's huge unnatural harem... but it was just a dream.,5,False,0
8413,Willow visits her “Mother” deep in the forest. ,5,False,0
10486,"Clovis as Roman emperor Augustus, on his throne. With his guard legioners, romulus and remus on each side.",5,False,0
4279,Karen introduces Maddie to Magpie. Maddie is critical at the sight of such an unorthodox Basitin.,5,False,0
436,Flora builds a pillow fort/cave curled up in it staring at trace with Demonic eyes scaring Trace that he is Feral.,5,False,0
10216,"Beauty and the Beast - Trace as a white tiger and Flora as a human, in formal wear and dancing ",5,False,0
4021,"Sythe & Nibbs fix a sink but the instructions were unclear, Nibbs got stuck in the drain pipe",5,False,0
4015,"Nora plays Cupid again, and hits Flora!",5,False,0
9963,Flora decides to test Stoney to see if he'll be a good companion for her upcoming baby once it's born. She likes him! Good boy!,5,False,0
8444,Human Raine discovers Zen's true weakness. The boy is both powerless and adorable when being giving the all mighty ear rubs.,5,False,0
414,Trace leaves a bar with Alaric and Tigress instead of Flora and Keith,5,False,0
9933,Willow body pillow,5,False,0
9935,"Good morning, Princess Reni. (Dragon form)",5,False,0
7914,"Bodyswapped Keith and Natani sparring. Keith still wins, and now Natani knows what it's like to be pinned by their own body",5,False,0
8197,"Flora & Trace saw the portrait of Rose, and wants one of them (portrait of Flora or Trace, or together)",5,False,0
410,Euchre's Flawless Transformation,5,False,0
10476,Modern AU: Flora and Ivy have a sister spa day by getting a pawdicure!,5,False,0
6574,Raine in a maid outfit (wolf),5,False,0
889,The main group with parts switched around (example Trace with Flora's tail or Flora with Nanani's chest),5,False,0
7916,Natani and Keith get into cutesy cuddling ,5,False,0
4000,Maddie and Maeve get crafty (and messy) making Valentine’s Day cards. Nibbly inspects the stack of glitter shakers,5,False,0
400,Kieth teaches Natani how to sword fight,5,False,0
8443,"Sequel to ""Island Style Reni"" with Reni hula-dancing, flanked by VixenMike and FemBrutus. Nora 'helps' Reni impress Kei by stealing Reni's grass skirt (also Mike's and Brutus'), leaving Reni bottomless, embarrassed and blushing.",5,False,0
3938,"Natani's Magical Chest Wraps store, customers include Fem-Clovis and Shiro from Rascals",5,False,0
3981,giant robo Keith and Godzilla Natani have an epic monster battle,5,False,0
387,Keith as a Titan and Natani as a Hunter from Destiny,5,False,0
3982,"Keith and Natani finally have sax, start a jazz band",5,False,0
894,"Natani(Titan), Flora(Hunter), and Trace(Warlock) in the world of destiny",5,False,0
8206,Fire and ice. A magic duel between Clovis and Natani with fireballs and ice bolts.,5,False,0
9990,"Basitin evolution: Basitin variants inspired by Jolteon, Flareon and Vaporeon.  ",5,False,0
9997,Good morning stilt-wolf,5,False,0
926,Kat angrily knitting baby clothes for Flora and Trace,5,False,0
489,Group A relaxing at the beach,5,False,0
280,"Flora in the virgin killer sweater, saying: “…my butt’s cold…”",5,False,0
9902,Mafia Nat and Zen are ordered to perform a hit on Keith (Member of Flora and Trace's gang) but things don't go as planned,5,False,0
599,Musclebound Lynn: A Pre-SeaLynn Date Encounter,5,False,0
577,Kindred from League of Legends,5,False,0
10173,Continuation from the X-Com snake lady and her soldier <3,5,False,0
10541,Kat can't take any money out of an ATM because she is overdrawn.,5,False,0
4060,Vixen Nora,5,False,0
10175,VV Mike embraces her new form and joins everyone skinny-dipping at the oasis,5,False,0
471,Nibbly (keidranized) sleeping with a Scythe plushie,5,False,0
8924,Anthro Reni Daki,5,False,0
10189,Modern AU: Cyberpunk Raine is helping Gaming Nora to find RHGUY69,5,False,0
1440,Trace meets His Tiger and his Dragon version of himself.,5,False,0
789,Dragon Laura,5,False,0
550,Crack Shipping: Keith x Kathrin,5,False,0
1176,Adira turns the tavern into a maid café,5,False,0
10278,Saria lounging on a bed of Rose,5,False,0
8278,"Euchre as Merlin telling young Trace as Arthur, “If you think magic will solve all your problems, it won’t!” (Disney’s Sword in the Stone Reference)",5,False,0
1333,Clovis likes knitting but doesn't want anybody to know about it,5,False,0
4579,"The Basitin trio walks in on Trace giving Flora a foot massage. They're reactions are embarrassed, scandalized, and intrigued. ",5,False,0
4578,Noodle Dragon Maddie,5,False,0
4571,A Tigress Noble helps guide two male human cartographers thought a expedition into Tiger territory to map out the region. Like Lewis and Clark with Sacajawea!,5,False,0
10032,Zen and Kat on a lunch date when a crow swoops in and steals a sandwich. Crow looks suspiciously un-crow like.,5,False,0
523,Mike and Evals at the bar,5,False,0
825,Some magic trick went wrong... (again!!) Kat and Keith swap bodies!,5,False,0
8731,"While waiting for Keith to return from banishment, how did Laura spend her time after migrating to the Basidian Islands?",5,False,0
1305,Saria playhouse with little Flora.,5,False,0
1189,Costume Contest: Raine Solo and ZenBacca,5,False,0
1464,"Flora Fort Part2: Flora conquers the Kitchen. Making Rose question Trace, and Reni notice Flora eyeing her.",5,False,0
4269,"Trace and flora riding through the mountains on a motorcycle on a beautiful spring day, it would be an amazing wallpaper.",5,False,0
515,"Raine and Zen Warped in a blanket, watching the stars together.",5,False,0
10511,AU Tigress Trace playing on a beaches water,5,False,0
6550,Keith and Natani stargazing on a quiet hill,5,False,0
7907,Saleen takes Lynn to the beach,5,False,0
8928,Kat with her kittens,5,False,0
10147,Grand Templar Trace stands victorious after a fierce battle with a Keidran army,5,False,0
598,Maddie as Ed from Cowboy Bebop,5,False,0
8856,Alright Gentleman. We all want *Very Vixen Mike against the Glass* don´t you agree?,5,False,0
1118,Basitin Trace trained by Keith.,5,False,0
10591,"Natani, Zen and Keith as the Spanish Inquisition from Monty Python. Nobody expects the Spanish Inquisition!",5,False,0
10162,Natani dressed as Tohno Akiha & Youngtani Dressed as Ciel from Tsukihime ,5,False,0
10165,Genderbend AU: F!Keith finds out the secret of Natani’s gender!,5,False,0
4107,"zen receives a valentines card, kat has to read it to him, it turns out to be very lewd, awkwardness ensues",5,False,0
8738,Very happy Seraphina in dragon form (wags her tail very quickly),5,False,0
4100,Nora plays cupid a again and hits flora in the butt!,5,False,0
6562,Anthro nibbs selling acorns form a long coat,5,False,0
8259,Very fixen Clovis,5,False,0
4042,Alaric in a classic female pin-up position.,5,False,0
4300,Trace and Flora enact the balcony scene from Romeo and Juliet,5,False,0
1101,"Halloween theme: Eric “The Collector” and Kathrin “The Mad Seamstress”. Eric, a patchwork of keidran body parts and Kathrin an insane yet whimsical seamstress",5,False,0
10138,Willow Reference Sheet,5,False,0
1106,Rose prancing through a field of roses,5,False,0
845,Lilith visits Zen as he recovers from his Keith inflicted sword wound,5,False,0
4036,Maren discovers magic and is drunk with power,5,False,0
4035,"Body swap - Flora in Trace's body playing with the baby, to Trace's discomfort in Flora's body",5,False,0
4296,Eris is just about to create Frankenstein's monster as evil trace comes over and is stared at by the monster awakened to life,5,False,0
1317,"Keith examining Zen's burn, unimpressed. ""Meh, I've done worse.""",5,False,0
10551,"Super Saiyan Adelaide, plus a small panel with Musclehead General and Alaric commenting on her power level.",5,False,0
1110,Adira turns the tavern into a maid cafe and has some cast to help run it.,5,False,0
10209,"Clumsy Ghost 2: Laura, stuck in Natani's body, goes to get help. Natani panics as Laura walks them out the door naked.",5,False,0
4068,landscape sketch of Wander riding Agro through the Forbidden Lands from Shadow of the Colossus,5,False,0
6090,Doggy Dragon. Nora gets a taste of her own medicine when a mirror bounces a prank back and becomes possessed by a dog.,5,False,0
3361,The Adrakist Seraphina and Dragon Girl Wrinry meet/argue who is more of a dragon.,5,False,0
8809,Young Roselyn Dakimakura,5,False,0
4970,"In a tavern, Clovis is too drunk to care about repressing his feminine side and Brutus is too drunk to figure out why this vixin seems so familiar.",5,False,0
1846,"The Female Heroine From ""The Halfkind"" Returns!",5,False,0
2505,"Kat day dreaming about who she likes more, Zen and Natani",5,False,0
3564,Hiccup Zen and Toothless Nora (How to Train Your Dragon),5,False,0
2508,"Kat tries to seduce Keith again and gets another chomped on the ear, this time from Keith.",5,False,0
8610,"""Lupus Dei!"" Nat and Zen on guitar, Sythe on the mic, Raine on organ, and Brutus on drums, dressed up in the style of Powerwolf, and ready to rock!",5,False,0
1852,Duel between “Pegleg” Zen & diplomat Sythe.,5,False,0
3574,Trace & Flora Vegas-syle Magic Show,5,False,0
2493,Zen playing Go-Fish with Youngtani and Natani,5,False,0
5720,"After losing a bet to Maddie and Karen, Red and Raine are giving free sled ride as a sled wolf team.",5,False,0
8187,"Natani as Tifa (blue dress), Laura as Aerith (red dress) and Keith as Cloud (fancy dress) from Don Corneo’s bride scene from Final Fantasy VII Remake.",5,False,0
3549,"UNSC Spartan Raine-Human Raine as a Spartan 4 from Halo, w/ Red as her Artificial Intelligence.",5,False,0
2477,Pre-Comic: Maren and Trace out on a romantic date amidst the trees and sunset.,5,False,0
1249,Archmage Raine gone to the dark side,5,False,0
659,Trace and Flora as Flint and Lupa from Bloodline,5,False,0
193,Flora as Overwatch D.Va,5,False,0
2543,Trace getting stuck in a Re: Zero time loop ,5,False,0
5986,Dark Trace force to relive the memories of 2012 mistletoe incident,5,False,0
8172,Evals shows the big adorable puppy dog eyes. How could anyone tell him no!,5,False,0
1573,Clovis’ Guild - Transvestites: Women in Disguise,5,False,0
2888,Terry Crews & Muscle Head Basitin General from comic 483 advertise for Ol' Basitin Spice.,5,False,0
6014,A picture of Keith and Laura’s wedding. Probably a sea-side ceremony.,5,False,0
6012,"An angry Raine (in her halfway form) shouts at Euchre and Mary for abandoning and neglecting her respectively, and declares that she is proud of who she is",5,False,0
2868,Flora & Kat take Trace & Eric shopping. Trace doesn't understand fashion & Eric can't keep his eyes off the locals,5,False,0
2867,Karen doing puppy eyes to touch Maddie's ears,5,False,0
8987,"Mike asks Sealeen to cure his very vixen transformation, and her ""cure"" turns him into a ""very human female"" instead.",5,False,0
3016,"In an AU, Flora and Sythe fall in love and start a family.",5,False,0
8988,Raine's nightmare: She become a feral keidran.,5,False,0
3019,Flora tells Trace about her short lifespan & asks Trace to forgive her for dying before him.,5,False,0
1192,Raine and Kat making voodoo dolls of their respective love interests...so they CANT ESCAPE.,5,False,0
6033,How would the fight between Trace and Mary have gone if she had somehow reflected his spell back at him?,5,False,0
5952,"Good Morning Flora, Kat version",5,False,0
1386,Saria's ghost returns to gossip with Flora about Trace,5,False,0
3727,Ghost Laura becomes a Ghost of Christmas Future.,5,False,0
5975,A Husky Keidran in a wintry forest.,5,False,0
2889,Sealeen Spikes Edinmires Water w/ her transformation potions,5,False,0
4918,Maeve making clock poses with her arms.,5,False,0
1784,Hobbes from 'Calvin & Hobbes' steals Trace's girl.,5,False,0
4932,Reni tries to light magical fireworks for the group. Accidentally sets off the whole box at once,5,False,0
1935,Ms. Nibbly sleeping on Karen's face like a kitten,5,False,0
1952,Karaoke Night on the Na'Rella. Who's the best singer,5,False,0
6826,"Nibbly claims the role of Grand Templar, free nuts for all!",5,False,0
5046,"The cast plays a board game they found in the estate, not realizing it was made by Nora and has more magical effects than Jumanji",5,False,0
3920,Luchador Adelaide supplexing a mask.,5,False,0
3923,Keith naked with a gift box on his crotch beckoning Natani to come unwrap her present.,5,False,0
172,Raine,5,False,0
3880,"Flora will be giving birth soon & tells Trace they should be making plans. Trace is ""a bit"" surprised.",5,False,0
1953,"Raine, Euchre & Mary sharing a happy family moment",5,False,0
3830,What if: Sealeen & Lynn Family portrait,5,False,0
3770,"Sythe and Maren, sipping hot cocoa riding in a one horse open sleigh through a city park.  ",5,False,0
6834,Transformation lapse of Raine ,5,False,0
5074,Flora and Kat doing the anime peace sign pose together,5,False,0
5007,Reni as a dog receiving pets from strangers and acting like she doesn’t enjoy it,5,False,0
5002,World War II pin-up Maren as sexy French maquis Resistance freedom fighter,5,False,0
8060,Biological/Anatomical differences between the species (height/age and such),5,False,0
1951,Trace gives Flora chocolates. chocolate is toxic to Keidran. ,5,False,0
1270,Sythe and Red carving pumpkins with swords to try and impress Raine! they could really go crazy,5,False,0
4929,Keith gets a turn being the big spoon (or in his case the backpack),5,False,0
1941,Alaric & Laura on a date in Keith's dreams,5,False,0
3604,The human explorer attempts to gift the snow leopard keidran a new tail.,5,False,0
2548,"Backside comparison, sythe and zen with Nibbly as judge.",5,False,0
1265,Natani messes up a chest shrinking spell and becomes Na-tiny.,5,False,0
8156,"Sequel to ""Island Style Reni"" with Reni getting her hula-skirt snatched away by a nude Vixen Mike as she's being chased by an equally nude Female Brutus (the latter not caring about their state of undress)--leaving Reni bottomless, blushing, exposed and embarrassed.",5,False,0
6304,Redraw of the old donation reward wallpaper with Flora snoozing next to a steam with a stalk of corn in her mouth and a butterfly resting on her paw.,5,False,0
1820,Wrinry being chased by sivil because she is in trouble.,5,False,0
8170,"Natani asking Kathrin on “how to be cute” for Keith, but Kathrin gets the wrong idea and supplies more lingerie. ",5,False,0
8169,Flora in a sundress in the middle of a meadow!,5,False,0
1281,"Kingdom Hearts 2: Trace as Sora w/ oathkeeper, Flora as Kiari w/ a paopu fruit, Keith as Riku w/ soul eater.",5,False,0
1782,Tiger Trace character Reference,5,False,0
1272,Twokinds characters playing hide and seek!,5,False,0
1950,Karen takes Fem Fur Red shopping... much to Red's dismay,5,False,0
3844,Keith naked with a gift box on his crotch beckoning Natani to come unwrap her present.,5,False,0
3848,Mike and Evals both share a passionate New Years Kiss,5,False,0
3850,Keith begrudgingly accepts that he’s the little spoon,5,False,0
6021,Flora and Kathrin Tea Time,5,False,0
2906,Happy families AU: A proud Euchre & Mary play w/ their new daughter.,5,False,0
1403,Flora is more stacked than Kat and shows off in front of her,5,False,0
7960,Keidran cannibals,5,False,0
6154,The Explorers enjoy watching the Tiger tribe ceremonial party celebrating the new year. With some of the tigers wanting them to join in.,5,False,0
5507,Roselyn and young Raine playing in the fall leaves.,5,False,0
6152,Transformation lapse of how Raine transforms into a wolf,5,False,0
5518,Our intrepid explorers find themselves in a savanna surrounded by a tribe of cheetah keidran armed with pointy spears!,5,False,0
6858,Flora's midnight lake dip,5,False,0
2983,sexy Laura dakimakura,5,False,0
5547,Rose gets drunk during a party and starts acting like her younger self much to everyone's confusion.,5,False,0
1493,Nibbly rocking out to some metal. \m/,5,False,0
5887,"During a snowy night time walk about in a city park, Zen and Raine stop to take a selfie.",5,False,0
2849,wholesome baby/young zen meets cocky adult zen,5,False,0
6048,Adira balancing the books for Riftwall,5,False,0
2842,Keith as Connor from Detroit: Become Human,5,False,0
5540,"4th ""Panel"" break ; Nora uses her powers to peer into our dimension and demand that Tom make Trace interested in her at once!",5,False,0
2992,Renamon walking away after beating up Eric for a portrait he did of her.,5,False,0
5791,Transformation lapse of Raine ,5,False,0
1534,"Baby Kathrin, held by young Eric.",5,False,0
5504,Flora pressed up against the screen,5,False,0
6217,"Landen And Madelyn accidentally make a coffee so strong, it turns into a coffee elemental.",5,False,0
6852,Human explorers visit the western Basitin territory and try to establish a trade agreement with them. Offering gifts to one another for a long friendships.,5,False,0
144,Kathrin and Zen out for lunch.,5,False,0
3130,"Muscle Head general riding on Reni, busting thru Edinmire barrack to advertise Basitin Spice.",5,False,0
6073,Transformation lapse of Raine,5,False,0
6052,Keith and Natani go on a camping trip to the woods and sit around a campfire roasting marshmallows at night looking up at the stars and not their now burning sticks,5,False,0
3139,"Rose gets frustrated that she has nothing to do, as the manor does everything",5,False,0
6133,Tigress Trace in her Thick Winter Coating,5,False,0
3147,"Flora and ""Slavegirl"" (Kat) bathing redux",5,False,0
3068,"The human explorer hugs one of the snow leopard's fluffy tails, causing a minor diplomatic incident",5,False,0
6208,"Sultry Trace on the bed. Flora likes very, very much.",5,False,0
3062,"Kessah from Hunters of Salamanstra meets Natani, wolf warriors!",5,False,0
6885,"Nora at a furry convention,transforming furries into keidrans,after she does that the crowd cheers and then Nora is confused why are they happy.",5,False,0
3093,The Basitin Generals dressed as British Field Marshalls from WWII.,5,False,0
5599,"The explorers to Tiger lands are invited to share a communal bed, much to their embarrassment",5,False,0
3109,Sealeen Spikes Edinmire's Water with her transformation potions.,5,False,0
3111,Human Flora & Tiger Trace Magic mishap ,5,False,0
403,"Sequel ""Doggie Dates""",5,False,0
5920,Keith and Natani out on a date run into Sythe and Maren who proceed to make excuses as to why they are out to dinner together.,5,False,0
2996,Zen defends Kat from Roderick ,5,False,0
8601,Spooky Nora is invading peoples dreams to turn them into girls.,5,False,0
5699,A Twokinds Carol:  Laura (Ghost of Christmas Present) shows General  Alabaster (Scrooge) the Keiser (Cratchit) Christmas dinner,5,False,0
110,Valkyrie Laura with Sword and/or Shield,5,False,0
5941,"Sequel to Fallout Mekkan sketch in which Flora, Trace, Deathclaw Nora, Keith, and also Natani explore the Sierra Madre and find Hologram Laura",5,False,0
8471,"Romulus and Remus put on a show at their previous job as the main act in a Chippendales-style exotic dance club. Clovis was just in the audience to scout potential new bodyguards, he swears!",5,False,0
2921,"Frankenstein Monster w/ different body parts oft all Wolf,Tiger,Fox,dragon,Basitin & etc",5,False,0
5758,Laura and Keith share a romantic dance together,5,False,0
3043,Maeve dancing because of a magic music box that she found ,5,False,0
3045,Diplomatic Sleepover 2: Keith caught between Trace and Flora.,5,False,0
1524,Plot Twist: “Clovis’ Guild - Transvestites: Women in Disguise”,5,False,0
5877,[Cosplay] Maren as Carmen Sandiego.,5,False,0
2950,Peeping Tom: The return of the pizza guy. Discovers Karen grabbing Maddie's ears.,5,False,0
3048,Nibbly meets Scarlet (Sequential Art),5,False,0
5864,"Young Nora. When she had not yet received the title of “Lady” and was just a little, playful, curious dragon.",5,False,0
5745,Pole Dancing Mike,5,False,0
2939,Mike's life if he hadn't been born a slave,5,False,0
5717,"Cat Maren grooming herself like a cat, next to Wolf Raine scratching herself with her foot like a dog.",5,False,0
6927,Good morning Vivian (Bloodline),5,False,0
6372,"Flora, Kat and Human Reni learning hula dancing from a south-seas(western) Bastin",5,False,0
5764,Festive Flora baby bump!,5,False,0
5697,Roselyn Age Chart,5,False,0
2781,Mike & Evals as Androids from Detroit: Become Human & Eric as the obvious owner,5,False,0
2978,Natani + Flora put a control collar on Keith & make him do embarrassing things.,5,False,0
2777,All the Basitin's males hiding from King Adelaide start a fight club.,5,False,0
5773,"As a slave, Mike receives his first gift ever from Evals.",5,False,0
8125,Tom breaks his hand from trying to draw the evals extended family reunion.,5,False,0
2958,"Sam, Ember, & Raine gossip over a book club meeting brunch about their favorite novels.",5,False,0
2772,Flora & Kathrin play beach ball.,5,False,0
5834,Kat asks Mike to go back to the rooms and hook up right now.,5,False,0
5832,Feral Sythe and kitty Maren snuggled up,5,False,0
1563,"After Trace wake up from a nightmare/bad memory, Flora comfort Trace and soothed him back to sleep.",5,False,0
2782,Adrakest Flora in flight,5,False,0
5948,Flora stomps on the Mistletoe so it can NEVER backfire on anyone ever again! Trace walks in moments later to find an angry Flora with her foot stuck in her mouth.,5,False,0
5690,Keith experiencing his first Keidran Christmas Day with Laura since his exile.,5,False,0
5691,"Sequel of ""Wedding Nightmares"": Maren sighs in relief but then turns her head and sees that Sythe is lying in bed with her. Maren wakes up screaming again.",5,False,0
8590,Templar Laura AU: Kathrin leading a slave raid on a human village alongside Mike and Evals,5,False,0
655,Natani's first attempt ever at magic,5,False,0
1550,"Lt. Alice Reed as Santa Clause, bringing the gift of JUSTICE.",5,False,0
1288,Natani and Zen dressed like Assassin's Creed characters.,5,False,0
85,Keidranized Nibbly boops Scythe with her nose against his,5,False,0
3503,Grand Templar Sealeen,5,False,0
7985,Dark archmage Maren.,5,False,0
9041,Wolf Watchers (Sequel to Peeping Squirrel) - Zen and Sythe attract a small crowd to secretly watch them bathe in the nude,5,False,0
2750,"Western Basitin leaders invite Adelaide & Keith to discuss relations, proper attire required",5,False,0
8082,Tiger Trace sleeping on Flora's chest,5,False,0
1357,"Natani tries out a spell to shrink her chest, but accidentally ends up shrinking Keith.",5,False,0
1356,"Keiren as an Ardakist, and Princess Reni's reaction",5,False,0
7978,"While exploring a cavern, dragon Reni accidentally discovers a tribe of kobolds",5,False,0
2537,"Natani and Adelaide as Sorceress and Amazon from Dragon's Crown, respectively.",5,False,0
90,Tigress Trace smirking at Vixen Eric,5,False,0
6964,Female Natani against glass,5,False,0
5128,Kat’s rollercoaster of emotion as she tries to thread a sewing needle.,5,False,0
