,name,date,votes,all_votes,winner,win_difference
9274,"a norwegian forest cat keidran, dressed in viking warrior armor/garb, riding aboard a viking ship with other fellow viking cats, all sailing for war.",2019-10-13 23:15:48.215111589+00:00,1,15,False,0
15231,lion saria daki,2021-07-18 21:22:56.956436623+00:00,1,27,False,0
15778,"gender swap au  : grand templar tracy legacy, sitting in a chair with an attendant beside her. at the peak of her villainous career. ",2021-10-04 03:00:58.962350374+00:00,1,20,False,0
9443,eris is traveling to catch several critters to fulfill the frankenstein project. but she has to be careful how she was not allowed to get caught by the templars back then,2019-11-11 00:21:52.783873324+00:00,1,4,False,0
15758,ora fusion panicking because she isn't able to unfuse,2021-10-04 00:26:54.467537306+00:00,1,10,False,0
2219,a redraw of the last panel of page 53,2022-01-24 01:34:06.288396503+00:00,1,22,False,0
9394,sealeen finally falls out of the manor tree! luckily she's caught by lynn,2019-11-04 02:05:35.654934843+00:00,1,10,False,0
9454,"chalchiuhtlicue ""calamity"" from no evil",2019-11-11 01:57:51.945433988+00:00,1,4,False,0
15229,rivet drawn in tom's style. ,2021-07-18 21:22:56.956436623+00:00,1,26,False,0
9732,our intrepid explorers find themselves in a savanna surrounded by a tribe of cheetah keidran armed with pointy spears!,2019-12-09 01:42:37.827035334+00:00,1,13,False,0
11906,the crew cosplaying lordi or kiss,2020-08-10 01:03:56.921922377+00:00,1,7,False,0
15592,mzzkiti taking a shower under a waterfall while on shore leave.,2021-09-20 00:07:54.659111387+00:00,1,25,False,0
9737,a sequel to lingerie proposal,2019-12-09 01:42:37.827035334+00:00,1,11,False,0
13019,captain jenny in a captain morgan pose with one foot up on a keg of rum and brandishing her cutlass.,2020-12-06 21:35:30.878208171+00:00,1,34,False,0
15764,"human cartographers visit the fox territory, seems they were welcomed and asking them many questions about humans.",2021-10-04 03:00:58.962350374+00:00,1,26,False,0
9205,"chalchiuhtlicue ""calamity"",  from no evil",2019-10-07 00:32:09.605906098+00:00,1,7,False,0
2493,vixen barkeep in coastal fox territory ,2022-02-21 04:00:46.267000700+00:00,1,31,False,0
8869,magpie reference sheet,2019-05-13 01:19:50.884795336+00:00,1,17,False,0
9301,"mordecai heller from lackadaisy cats, drawn in tom’s art style",2019-10-14 00:29:12.406476385+00:00,1,8,False,0
9334,"red as a barbarian wielding a double bladed battleaxe. (shape wise, preferably something like the axe of agony with a longer handle...if that's not too specific...)",2019-11-03 22:48:42.405331100+00:00,1,7,False,0
9605,"maren shopping with adult karen, trying to find clothes that fit her increasingly bizarre assortment of body parts.",2019-11-24 21:44:57.329552218+00:00,1,19,False,0
9295,"a redrawn updated version of the ""trading halves"" side comic page from way back",2019-10-14 00:29:12.406476385+00:00,1,8,False,0
15545,"chimera plays twister, her detachable limbs giving her a significant advantage.",2021-09-13 02:46:18.647019657+00:00,1,28,False,0
9238,sythe with a scythe,2019-10-13 20:15:08.518644558+00:00,1,14,False,0
8420,hueyhueycoyotl from no evil getting into shenanigans with madelyn,2019-03-11 00:06:33.421477754+00:00,1,30,False,0
9218,anthro nibbly getting help from sythe after getting her head stuck in a carved pumpkin,2019-10-07 00:32:09.605906098+00:00,1,20,False,0
9120,"maren, in nibbly's body, swaps bodies with scythe. now maren is a wolf, nibbly is maren, and scythe is a squirrel.",2019-08-19 01:54:04.153038564+00:00,1,13,False,0
9356,"sythe in regalia providing diplomatic relations ""advice"" to the basitin trio. lynn is studiously taking notes, but the other two are more suspicious. ",2019-11-04 00:07:39.763783951+00:00,1,11,False,0
1317,"eric finding the oasis room control panel, changing the occupant settings to ""ladies only"" with hillarious results.",2022-11-14 00:29:58.461256435+00:00,1,30,False,0
9290,eris is traveling to catch several critters to fulfill their frankenstein project. but she has to be careful how she was not allowed to get caught by the templars back then,2019-10-14 00:29:12.406476385+00:00,1,7,False,0
1767,"sythe and wolf maren have a romantic dinner (but secretly, sythe is going to propose to her)",2023-01-23 00:41:40.695850636+00:00,1,15,False,0
15149,rivet from ratchet and clank drawn in toms style.,2021-07-11 23:29:12.283586965+00:00,1,27,False,0
12018,humans explorers and tiger guide enter the unknown lands of the lizardfolk.,2020-08-23 21:13:52.915841630+00:00,1,24,False,0
12074,dragon-mail order basitins. basitin military guard attempting *yoink* to repel a dragon seige to prevent fulfillment *yoink* of basitin mail-orders.,2020-08-24 00:54:05.487289465+00:00,1,10,False,0
11943,fanart of fubuki from hololive,2020-08-16 22:34:35.164541116+00:00,1,7,False,0
11940,karen displaying sisterly love for maren,2020-08-16 22:34:35.164541116+00:00,1,21,False,0
15617,"double or nothing. sequel to scarlet returns - a second bet lost means sythe ends up taking ""scarlet"" out for dinner, and she's not enjoying it, she swears.",2021-09-20 00:07:54.659111387+00:00,1,30,False,0
9412,"sythe misreads a vial a totally trustworthy stranger gave him. it turns him into a squirrel; no one knows, no one can understand him, but to mrs. nibbly, it’s christmas. ",2019-11-10 21:39:54.593753470+00:00,1,17,False,0
9400,"transformation sequence of a human changing into adrakist ,after that into a dragon(with percentage how much the person is a dragon).",2019-11-10 21:39:54.593753470+00:00,1,15,False,0
2131,vixen eric sneaking into the ladies lockerroom,2022-01-10 02:13:06.329640715+00:00,1,24,False,0
13122,no evil kajortoq post red tezcatlipoca (episode 36 1:19),2020-12-13 22:19:43.860078824+00:00,1,15,False,0
9111,keidranized okami amaterasu ,2019-08-19 01:54:04.153038564+00:00,1,11,False,0
9099,eris is traveling to catch several critters to fulfill their frankenstein project. but she has to be careful how she was not allowed to get caught by the templars back then,2019-08-19 00:15:34.707355723+00:00,1,8,False,0
1057,"twokinds high boys discussing the new videos made by a suspiciously familiar fox streamer who dropped out of college to make videos online, an easter egg in the game mayhaps?",2022-10-23 22:43:33.518512441+00:00,1,21,False,0
11447,keidranified mr. nibbly and fem!sythe,2020-06-22 00:05:12.256417058+00:00,1,12,False,0
15447,"female keidran and male human from ""notable civilizations"" on a date.",2021-09-06 04:00:32.176678542+00:00,1,19,False,0
9864,the cartographers enjoy watching tiger tribe ceremonial parties of the passing of the new year. with a tigress and the noble tigress offer them to dance with them.,2020-01-05 21:18:32.504671785+00:00,1,25,False,0
9867,sythe dressed up in aztec clothing,2020-01-05 21:18:32.504671785+00:00,1,17,False,0
11475,explorers are terrified when a keidran tribe introduces them to cliff diving.,2020-06-22 00:57:07.820330030+00:00,1,13,False,0
1343,good morning therie,2022-11-14 01:49:06.072165533+00:00,1,35,False,0
8727,human,2019-05-05 19:50:41.060852200+00:00,1,6,False,0
9889,legosi and haru dancing from beastars,2020-01-05 23:11:47.662419466+00:00,1,12,False,0
11440,what does pet daughter look like after these two and a half years since the last time we saw her?,2020-06-21 22:25:54.960175468+00:00,1,22,False,0
10002,"the ""that 2 a.m fresh air"" youtube music video photo but with the gang.",2020-01-26 21:10:36.773331467+00:00,1,7,False,0
10006,[cosplay] maren as carmen sandiego.,2020-01-26 21:10:36.773331467+00:00,1,21,False,0
2269,genderswap au: tracy's evil smoke hallucination having a freakout/mental breakdown about the pregnancy.,2022-01-24 04:37:03.464399718+00:00,1,24,False,0
8783,"""vindictive twin tigers vs vindictive twin foxes"" (panty & stocking vs scanty & kneesocks)",2019-05-06 00:16:47.534407552+00:00,1,18,False,0
8781,world war ii pin-up maren as sexy french marquis resistance freedom fighter,2019-05-06 00:16:47.534407552+00:00,1,19,False,0
10021,"""grand templar mary siverlock learns that eris has broken into a keidran village where a peace agreement has been made and is not happy about it	""",2020-01-26 23:01:01.424370699+00:00,1,11,False,0
11816,"older karen has started a keidran pup sanctuary where snuggles are so numerous as soon as they learn to walk, they run! ...away.",2020-08-03 02:37:13.738839731+00:00,1,12,False,0
11702,"squirrel maren cuddling sythe, who is both flustered and excited",2020-07-13 04:05:08.986907382+00:00,1,17,False,0
10025,the summoning table initiates emergency forgotten birthday procedure. maren is teleported in flowers and crashed under flowers and chocolate.,2020-01-26 23:01:01.424370699+00:00,1,20,False,0
1218,the modern trio suffering from a sugar-crash following trick or treating,2022-11-07 00:29:37.479862168+00:00,1,15,False,0
9953,"our northern explorer sinks chest deep in snow.  the snow leopards have a laugh, as their large paws prevent such things.",2020-01-12 23:43:53.415429989+00:00,1,24,False,0
1164,"sythe has fallen off his bike and skinned his knee, but maren is there to kiss his boo-boo and make it all better.",2022-11-06 22:22:32.769114523+00:00,1,18,False,0
15638,"windstraw rolling around acting like a kitten while amelia watches from behind bar, laughing and holding an opened bag of catnip",2021-09-20 03:43:10.907398096+00:00,1,23,False,0
11383,windstraw mistakes ms. nibbly for a pest in her bar and catches her. sythe notices and becomes quite anxious.,2020-06-15 03:37:11.690737707+00:00,1,13,False,0
11382,western basitins strip search carver to... um... check for weapons.  yeah.,2020-06-15 03:37:11.690737707+00:00,1,16,False,0
16194,scarlet going out on a date with sythe and liking it to her surprise and somewhat horror,2021-11-22 00:41:04.074092985+00:00,1,27,False,0
15516,"portrait of amelia riftwall like ""adira practice painting""",2021-09-13 01:15:50.661559308+00:00,1,26,False,0
2074,ty and shazza from ty the tasmanian tiger ,2022-01-09 23:00:27.859737846+00:00,1,15,False,0
1364,"a very drunk amelia reaches for the turkey on her plate, but accidentally grabs windstraw instead. despite windstraw’s pleas, amelia happily noms her right in the belly",2022-11-14 03:32:51.845583927+00:00,1,28,False,0
2076,"the templar leadership run afoul of a spell of mass keidranification, with the resulting loss of their magical abilities.",2022-01-09 23:00:27.859737846+00:00,1,29,False,0
2254,"mizzkiti, lying in her bunk, enjoying her new squeaky mousie toy she got for the holidays. ",2022-01-24 03:04:32.351310396+00:00,1,25,False,0
1347,"a female scp-1471 (mal0) waving at the viewer. don't let her creepy appearance fool you, she's very nice, loving, and just wants to be friends!",2022-11-14 01:49:06.072165533+00:00,1,24,False,0
8729,west basitin,2019-05-05 19:50:41.060852200+00:00,1,7,False,0
8726,dog,2019-05-05 19:50:41.060852200+00:00,1,4,False,0
15526,"gender swap au  : grand templar tracy legacy, sitting in a chair with an attendant beside her. at the peak of her villainous career. ",2021-09-13 01:15:50.661559308+00:00,1,22,False,0
8803,shelter from heavy rainfall,2019-05-06 01:32:21.199622203+00:00,1,9,False,0
2260,sythe finally answers the question: why do other keidrans have hairdoos while you just have more fur? ,2022-01-24 04:37:03.464399718+00:00,1,19,False,0
15915,modern au: morning commute scene at new edinmire train station,2021-11-07 21:41:39.711915110+00:00,1,28,False,0
15444,"wolf maren nuzzling sythe, telling him it’s purely out of instinct.",2021-09-06 04:00:32.176678542+00:00,1,26,False,0
15981,nibbs running off with the leftover halloween candy (possibly storing for winter),2021-11-08 01:37:11.515622008+00:00,1,16,False,0
16032,the main group playing squid games,2021-11-08 02:42:41.081844495+00:00,1,13,False,0
11703,nibblyzilla: a kaiju sized mrs. nibbly towers of edinmire while sythe tries to convince the panicked stricken villages she means no harm. ,2020-07-13 04:05:08.986907382+00:00,1,15,False,0
11671,erilas daki,2020-07-13 03:17:01.316433603+00:00,1,16,False,0
16012,"nibbly has her ""princess moment"", ala beauty and the beast, with sythe but it's a vivid dream. the party has never seen a squirrel hug an acorn with such a goofy look while asleep.",2021-11-08 02:42:41.081844495+00:00,1,21,False,0
16037,"anklet of humanification - ""human vehra"" she regains memories & magical prowess.",2021-11-14 22:12:52.156335557+00:00,1,24,False,0
16005,"cassidy catches the human male in a headlock and gives him a playful brotherly noogie, smiling and saying ""c'mere you big dork!""",2021-11-08 02:42:41.081844495+00:00,1,23,False,0
15478,"keiren and daniels are on patrol, miami vice style. dressed in linen suits, shades, and a fancy coupe as their ride.",2021-09-12 22:03:59.150283064+00:00,1,25,False,0
11760,the main characters as marvel heroes,2020-08-02 23:18:11.000629534+00:00,1,13,False,0
11608,"a serval keidran meat smoker, chubby from sampling her product too much.",2020-07-13 00:20:37.437319882+00:00,1,16,False,0
15989,"sequel to wolf maren nuzzle, maren wakes up next to sythe with a shocked expression, and sythe is peacefully sleeping.",2021-11-08 01:37:11.515622008+00:00,1,32,False,0
11643,"eric after hitting the gym, trying to woo some keidran girls by striking poses like johnny bravo. iconic sunglasses mandatory.",2020-07-13 02:08:37.428424217+00:00,1,18,False,0
10014,"“baby nibbly”: sythe finds a special hag stone that allows the holder to see what their subject looked like as a baby; out of curiosity, he points it at nibbly",2020-01-26 21:10:36.773331467+00:00,1,18,False,0
10065,legosi and haru from beastars dancing,2020-01-27 00:11:23.820671070+00:00,1,8,False,0
11718,"on maren's balcony, sythe appears as the reaper and tells her to not be afraid.",2020-08-02 21:17:07.107729070+00:00,1,13,False,0
10087,"sythe in regalia providing diplomatic relations ""advice"" to the basitin trio. lynn is studiously taking notes, but the other two are more suspicious.",2020-01-27 00:50:41.363033405+00:00,1,11,False,0
15418,"the female basitin from notable civilizations, going on a date",2021-09-06 02:52:27.459815576+00:00,1,19,False,0
15802,vampire lioness saria,2021-10-10 21:52:13.933335873+00:00,1,25,False,0
11854,"dog keidrans playing poker, featuring colin. brutus is winning with the perfect poker face, his goofy smile.",2020-08-09 22:26:50.880524815+00:00,1,24,False,0
9990,legosi and haru from beastars dancing together,2020-01-13 02:28:29.480761331+00:00,1,10,False,0
9988,karen acting like your standard “i-wanna-see-your manager” karen to some templar guards,2020-01-13 02:28:29.480761331+00:00,1,14,False,0
15346,kitty karen takes a cat nap in the sun of the oasis room,2021-07-19 03:11:31.331594613+00:00,1,24,False,0
2233,"karen gains a new set of ears, this time the basitin variant ‒ and finds them quite sensitive to the touch.",2022-01-24 03:04:32.351310396+00:00,1,24,False,0
9960,legosi and haru from “beastars”.,2020-01-13 01:18:06.959888930+00:00,1,13,False,0
1382,brutus plays santa for the local orphanage.,2022-12-11 23:18:39.516426119+00:00,1,24,False,0
8736,what if: sealeen & lynn family portrait,2019-05-05 20:18:00.980282848+00:00,1,16,False,0
15602,amelia dakimakura / body pillow design,2021-09-20 00:07:54.659111387+00:00,1,28,False,0
10172,merveille million from solatorobo,2020-02-17 01:31:32.589611242+00:00,1,10,False,0
10170,madelyn teaching karen how to sneak around like her.,2020-02-17 01:31:32.589611242+00:00,1,17,False,0
1464,eris visits the mansion and indirectly asks if they might have seen their chimera project,2022-12-12 02:27:26.702439415+00:00,1,17,False,0
12260,keidran hard rock band with red on vocals.,2020-09-13 23:10:45.135656062+00:00,1,17,False,0
16070,madelyn dressed as scout from team fortress 2 stealing the intelligence,2021-11-15 00:44:53.309989299+00:00,1,31,False,0
15126,"sythe is teasing female (cursed) red. red puts on a convincing show of not-liking-it-at-all. maren and nibbly are jealous, and work together and steal sythe back.",2021-07-11 21:24:48.938744432+00:00,1,25,False,0
10195,a look into the sexy keidren all-male bath house,2020-02-23 21:16:44.891912683+00:00,1,13,False,0
10133,"sythe and mrs. nibbly meet their alternate universe counterparts, where mrs. nibbly is the keidran and sythe is the animal pet",2020-02-16 23:59:36.758197785+00:00,1,23,False,0
12243,page 55 but modern au & non-rude radiologist tom,2020-09-13 21:26:21.922311280+00:00,1,14,False,0
1463,death diving. everyone jumping from an extreme height into a lake,2022-12-12 02:27:26.702439415+00:00,1,19,False,0
16088,"the north basitin huntress finally catches that darn bunny, but her wolf companion rabbit is giving her the sad puppy-dog eyes of ""can we keep it?""",2021-11-15 00:44:53.309989299+00:00,1,32,False,0
12195,the dreaded bwoom pen is going after all the boys now! it cant be stopped!,2020-09-06 21:53:55.962208307+00:00,1,15,False,0
10164,sarah n. dippity. she is the pink cat character from the youtube animation 'the world ending by atroxchobatsu',2020-02-17 01:31:32.589611242+00:00,1,8,False,0
9511,"maren in a one-piece swimsuit, with mischievous karen behind her about to drop a fish down the back of her suit.",2019-11-17 22:20:41.455981072+00:00,1,17,False,0
12180,"amelia and windstraw 2: amelia tasks windstraw with serving drinks due to the tavern being so understaffed, which proves to be a big struggle given her small size.",2020-09-06 21:30:26.292371140+00:00,1,20,False,0
2179,"sythe with his hair down, and/or wearing a women's bikini.",2022-01-23 22:27:29.089369203+00:00,1,18,False,0
8791,smug nibbles anthro version,2019-05-06 01:32:21.199622203+00:00,1,17,False,0
9448,gender/dragon curse spa! where all those affected by a curse can relax and ease the stress and chaos cause by their body shifting curses,2019-11-11 01:57:51.945433988+00:00,1,10,False,0
9458,what if: sealeen & lynn family portrait,2019-11-11 01:57:51.945433988+00:00,1,10,False,0
9464,"sythe in regalia providing diplomatic relations ""advice"" to the basitin trio. lynn is studiously taking notes, but the other two are more suspicious. ",2019-11-11 01:57:51.945433988+00:00,1,13,False,0
9433,a sequel to lingerie proposal,2019-11-11 00:21:52.783873324+00:00,1,19,False,0
9506,"sythe in regalia providing diplomatic relations ""advice"" to the basitin trio. lynn is studiously taking notes, but the other two are more suspicious. ",2019-11-17 22:20:41.455981072+00:00,1,17,False,0
12143,page 55 but modern au & non-rude radiologist tom,2020-09-06 20:56:42.945912909+00:00,1,15,False,0
10185,"our northern explorer sinks chest deep in snow.  the snow leopards have a laugh, as their large paws prevent such things",2020-02-17 01:31:32.589611242+00:00,1,16,False,0
12144,an ordeal for a spy. male keidran without pants are resting in the pool while madelyn is hiding underwater.,2020-09-06 20:56:42.945912909+00:00,1,15,False,0
10139,grand templar mary siverlock learns that eris has broken into a keidran village where a peace agreement has been made and is not happy about it,2020-02-17 01:05:45.804426800+00:00,1,10,False,0
15183,lynn writes down gossip from the main cast while lurking offscreen,2021-07-12 01:05:02.860244236+00:00,1,25,False,0
1003,"red and sythe reflect on how being forced to work together to help keep team b alive has changed them, with red especially realising what an arse he was, and sythe assuring him that he's slowly...slowly getting better about it.",2022-10-17 02:55:10.829750173+00:00,1,25,False,0
10220,"the main cast dressed as disney princesses, all female",2020-02-23 22:46:34.755861565+00:00,1,11,False,0
1258,"sythe brings maren home after their night at the club, and as he beings to leave, she pulls him into a kiss.",2022-11-07 01:42:15.166659099+00:00,1,16,False,0
11554,"human explorers visit the western basitin territory and try to establish a trade agreement with them, offering gifts for peaceful relations.",2020-07-06 00:30:43.026822483+00:00,1,16,False,0
11596,grand templar mary siverlock learns that eris has broken into a keidran village where a peace agreement has been made and is not happy about it,2020-07-06 02:22:03.453672329+00:00,1,7,False,0
10215,eric gets feedback about his suggestions for the cast.,2020-02-23 22:46:34.755861565+00:00,1,23,False,0
8937,"mini-dragon continuation: in her new dragon form, saraphina goes on a mini rampage: buzzing people, stealing food and setting decorative plants ablaze. ",2019-06-30 23:26:08.895335324+00:00,1,10,False,0
8914,nathan as a hunter or warrior alliance in the world of warcraft.,2019-06-30 21:48:22.906570385+00:00,1,7,False,0
16151,desktop wallpaper of the gang lying next to each other like in the october 24 2021 filler page.,2021-11-21 22:41:00.075465096+00:00,1,23,False,0
15521,sam and collin head out for some fun at a fair ground. time for a friendly competition to determine who is better at knocking the cans off.,2021-09-13 01:15:50.661559308+00:00,1,27,False,0
15296,femred and femsythe get in a cat-fight over malemaren.,2021-07-19 00:38:39.758861199+00:00,1,19,False,0
8943,the human cartographer meets the fluffy snow basitins of castle heywood.,2019-06-30 23:26:08.895335324+00:00,1,10,False,0
11416,"a wolf wears a ""skin-suit"" to try and blend in with the humans",2020-06-21 20:23:31.791617994+00:00,1,19,False,0
11409,grand templar mary siverlock learns that eris has broken into a keidran village where a peace agreement has been made and is not happy about it,2020-06-21 20:23:31.791617994+00:00,1,12,False,0
11530,"eric after hitting the gym, trying to woo some keidran girls by striking poses like johnny bravo.",2020-07-05 22:51:21.383213788+00:00,1,17,False,0
15395,maren meets wolf maren and cat maren,2021-09-06 01:03:22.428715979+00:00,1,22,False,0
9005,older frisk and asriel (from undertale) with asriel suddenly turned into a lady and frisk getting all *flirty,2019-07-14 22:20:39.951140685+00:00,1,17,False,0
10305,maren and sythe as belle and the beast dancing in the ballroom from the film.,2020-03-08 21:21:14.568796233+00:00,1,9,False,0
15652,a kind gathering around the campfire between humans and keidran,2021-09-20 04:37:55.119177726+00:00,1,25,False,0
10292,traditional snow leopard celebration,2020-03-08 21:21:14.568796233+00:00,1,11,False,0
10316,tom’s take on animal crossing’s isabel,2020-03-08 23:20:20.659355314+00:00,1,13,False,0
11597,dragon age chart,2020-07-06 02:22:03.453672329+00:00,1,19,False,0
2116,"the aftermath of new years at the riftwall, a bunch of drunks and a crashed dragon",2022-01-10 01:06:52.932453391+00:00,1,36,False,0
11594,isabelle from animal crossing,2020-07-06 02:22:03.453672329+00:00,1,16,False,0
4582,tk group 1 as final fantasy 15 characters,2017-06-18 23:48:00.733812033+00:00,1,30,False,0
2012,prehistoric brutus vs a mammoth- i just imaging this brutus being able to one shot a mammoth.,2022-01-03 01:21:54.054735012+00:00,1,31,False,0
14931,soldiers of the wolf army attempt to put on captured human armor. (failing epicly),2021-06-20 23:55:06.909045035+00:00,1,22,False,0
4391,[database error] discovers the (op) power of the furious power fist from fallout 4,2017-05-22 01:01:52.212105333+00:00,1,31,False,0
2005,cassidy and human are watching a movie together,2022-01-02 23:43:02.230912281+00:00,1,27,False,0
14166,"hide and seek with ms. nibbly! she is hiding somewhere in the picture, where she is lying in wait waiting to steal yet another pair of clothes",2021-04-05 03:28:28.134953503+00:00,1,25,False,0
6510,"karen eating watermelon, wearing a watermelon shirt",2018-05-07 00:28:51.088087362+00:00,1,20,False,0
14158,the new female lombax from ratchet and clank: rift apart posing like rosie the riveter,2021-04-05 02:13:54.680717527+00:00,1,16,False,0
14148,keidranified nibbly eagerly pressing her bust against an embarrassed fem sythe's,2021-04-05 02:13:54.680717527+00:00,1,29,False,0
13978,"maren and karen as ann and nancy of heart in the style of the little queen album cover. ooh, barracuda!",2021-03-21 21:11:21.363027135+00:00,1,19,False,0
13976,"nibbly with the mana crystals starts levitating and becomes archmage nibbly.  (though her spells likely just involve transformation, collecting nuts, and magical nib nabbing.)",2021-03-21 21:11:21.363027135+00:00,1,29,False,0
14636,the chimera meets red and he thinks she's a monster attacking,2021-05-24 03:59:46.798944390+00:00,1,17,False,0
901,maren scissorhands,2022-10-03 03:40:36.743365679+00:00,1,22,False,0
13954,hunters of salamanstra and two kinds valentines party,2021-02-22 04:02:39.443224837+00:00,1,15,False,0
6667,eric boops ket. she is not amused. ,2018-06-10 20:02:06.470659224+00:00,1,35,False,0
731,sythe as samurai jack vs the three blind archers,2022-09-18 23:04:46.782955493+00:00,1,29,False,0
4445,group a playing a card game such as poker or euchre.,2017-06-05 02:44:58.102213428+00:00,1,23,False,0
1854,twokinds meets the witcher ,2023-02-05 21:20:28.159304725+00:00,1,11,False,0
5841,wrinry being chased by sivil for yanking his tail,2018-01-22 00:38:06.889946547+00:00,1,36,False,0
669,the three basitin generals as the awakened pillar men from jojo's bizarre adventures,2022-09-12 02:05:55.116992351+00:00,1,25,False,0
15111,rivet from ratchet and clank drawn in tom's style. ,2021-07-05 01:31:32.628649464+00:00,1,19,False,0
14054,"madeline working out, looking very determined, with the hope to be stronger and taking more seriously. ",2021-03-22 02:44:11.121138440+00:00,1,33,False,0
14096,double date sequel: the group have a nice dinner despite the awkwardness,2021-04-04 21:41:18.457258680+00:00,1,32,False,0
4443,albion & cornelius in happier times,2017-06-05 02:44:58.102213428+00:00,1,20,False,0
