,name,date,votes,all_votes,winner,win_difference
14200,remus wearing the cone of shame after his run in with nibs,2021-04-11 21:16:45.843598864+00:00,4,33,False,0
14620,"so we know romulus's day job is sensing lies, but what's his side hustle then? what unusual side gig(s) does a wolf assassin take to make ends meet?",2021-05-24 03:59:46.798944390+00:00,4,19,False,0
12266,romulus and remus as founders of rome,2020-09-13 23:10:45.135656062+00:00,4,22,False,0
5132,eric's first drawing lessons with a model,2017-09-25 00:45:17.020158780+00:00,4,40,False,0
13996,"a minor diplomatic incident occurs when the tiger diplomatic party is invited to the estate for negotiations. where they are introduced to the legacys, much to iris's embarrassment. ",2021-03-21 21:11:21.363027135+00:00,4,32,False,0
1926,"maren and sythe in a karaoke bar, on stage together singing to the best of their abilities.",2023-02-06 03:40:54.040440236+00:00,4,11,False,0
2776,good morning madelyn ,2022-05-16 00:00:12.652678991+00:00,4,21,False,0
15851,gangster au cat clan crime syndicate speakeasy,2021-10-10 23:52:29.177745044+00:00,4,29,False,0
3883,maren as clara and sythe as hans-peter from the nutcracker.,2021-12-13 01:30:08.762239116+00:00,4,23,False,0
2904,sythe carrying a drunk maren to bed who starts making advances towards him,2022-05-22 23:12:40.057033195+00:00,4,43,False,0
1837,good morning northren basitin huntress,2023-02-05 21:20:28.159304725+00:00,4,39,False,0
2519,"carver getting the spa treatment from the western basitin girls, including getting some body paint",2022-02-21 04:26:03.344922949+00:00,4,29,False,0
2340,sequel to cat maren lingerie: maren decides to entertain sythe despite him never asking her for it.,2022-02-13 23:56:56.373022187+00:00,4,26,False,0
2197,kerdian scientists try to find out why everyone is turning into humans and vice versa,2022-01-23 22:27:29.089369203+00:00,4,26,False,0
1087,nibbly looses tiny scythe from size reversal and now he’s on a grand honey i shrunk the kids adventure in the mansion. mission one food that giant pizza looks delicious! scythe might even think it’s the most beautiful thing he’s ever seen!,2022-10-24 00:34:40.695282432+00:00,4,25,False,0
2566,windstraw updated ref sheet,2022-03-07 00:32:06.163009286+00:00,4,21,False,0
4063,"femwolf red tries removing the collar, violating the bet. the collar compels him remove everything but the collar instead. now he has to spend the rest of the bet in the fur.",2021-12-20 04:01:12.673741185+00:00,4,25,False,0
3129,desert basitin assassin rising up from the sand dunes to confront their target.,2022-06-13 02:42:38.124486035+00:00,4,30,False,0
2292,happy valentine's day! bloodline's bernin gets begrudgingly(?) taken on a v-day date with vivian. ,2022-02-13 22:07:53.922572270+00:00,4,19,False,0
2812,seraphina is in the world warrior tournament and it is the car smash stage.,2022-05-16 01:26:41.097484947+00:00,4,23,False,0
3800,sythe and maren enchanted mistletoe 3: sythe and maren switch species,2021-12-06 02:08:43.772091416+00:00,4,31,False,0
1720,lynx reed is being flirted with by three lynx and reed stopping them like the scene in jurassic world. ,2023-01-16 04:10:55.128696558+00:00,4,13,False,0
2690,"an older brahn's daughter, the seer, as the irish war goddess, the morrigan, surrounded by a murder of crows (based on the ulster cycle)",2022-05-02 00:59:36.678913268+00:00,4,20,False,0
3781,"sequel to dancing practice, maren takes sythe to a more private place.",2021-12-06 00:06:28.933317378+00:00,4,28,False,0
2194,sythe showing maren some more traditional keidran dance techniques.,2022-01-23 22:27:29.089369203+00:00,4,27,False,0
1457,landen and sealeen reference sheet,2022-12-12 02:27:26.702439415+00:00,4,28,False,0
1586,the modern trio taking a selfie in front of the twokinds counterpart of the rockefeller christmas tree,2022-12-19 03:06:46.257666088+00:00,4,24,False,0
3667,goodmorning iris,2022-05-02 00:07:11.600089930+00:00,4,25,False,0
2167,"after the new years party, sythe carries maren to her bed, who proceeds gives him a kiss while in a drunken state.",2022-01-10 03:24:42.555354954+00:00,4,33,False,0
2261,"what a party! the snow wolf and northern basitin wake in a vary messed up room and lots of bottles and both of them in bed together, and notice the snow leopard couple making breakfast",2022-01-24 04:37:03.464399718+00:00,4,25,False,0
1444,"red and sythe reflect on how being forced to work together to help keep team b alive has changed them, with red especially realising what an arse he was, and sythe snarkily assuring him that he's slowly...slowly getting better about it.",2022-12-12 02:27:26.702439415+00:00,4,20,False,0
1697,"red and sythe reflect on how being forced to work together to help keep team b alive has changed them, with red especially realising what an arse he was, and sythe snarkily assuring him that he's slowly...slowly getting better about it.",2023-01-16 04:10:55.128696558+00:00,4,21,False,0
1213,"diplomatic mishap, sythe and maren visit the eastern basitins but are dressed for the west",2022-11-07 00:29:37.479862168+00:00,4,23,False,0
1002,"sythe brings maren home after their night at the club, and as he leaves, she pulls him into a kiss. ",2022-10-17 02:55:10.829750173+00:00,4,25,False,0
2082,"chimera celebrates new year's eve with the others and when they throw the first firecrackers, chimera and the stoneward bring the firecrackers back to the horror of the others",2022-01-09 23:00:27.859737846+00:00,4,27,False,0
1742,fnaf style pizza place with the main characters as the animatronics,2023-01-22 22:25:47.241303313+00:00,4,28,False,0
972,karen gets turned into a wolf and gives a group hug to wolf maren and sythe excited over the idea of being wolf family for halloween: “we get to be a wolf family!”,2022-10-17 00:10:39.904043869+00:00,4,35,False,0
1248,"sythe as samurai jack, vs the three blind archers ",2022-11-07 01:42:15.166659099+00:00,4,24,False,0
15845,modern au railway station scene,2021-10-10 23:52:29.177745044+00:00,4,28,False,0
1517,good morning basitin policewoman,2022-12-18 22:38:52.049500349+00:00,4,22,False,0
1249,modern trio thanksgiving celebration,2022-11-07 01:42:15.166659099+00:00,4,29,False,0
3273,amelia dresses windstraw up as a leprechaun to bring in the st patrick's day customers ,2022-03-21 00:42:55.721075510+00:00,4,25,False,0
1509,"a female scp-1471 (mal0) waving at the viewer. don't let her creepy appearance fool you, she's very nice, loving, and just wants to be friends!",2022-12-18 22:38:52.049500349+00:00,4,22,False,0
1156,"red and sythe reflect on how being forced to work together to help keep team b alive has changed them, with red especially realising what an arse he was, and sythe assuring him that he's slowly...slowly getting better about it.",2022-11-06 22:22:32.769114523+00:00,4,26,False,0
2632,"what a party! the snow wolf and northern basitin wake in a vary messed up room and lots of bottles and both of them in bed together, and notice the snow leopard couple making breakfast",2022-03-07 03:41:01.344218906+00:00,4,26,False,0
2878,"sythe gives maren a necklace as a gift, however due to a mix-up, the original necklace was switched with a subtleseed necklace. ",2022-05-22 22:02:51.981967835+00:00,4,31,False,0
2189,"nibbly got magic pen, bad days comes to all sythe enemies.",2022-01-23 22:27:29.089369203+00:00,4,23,False,0
2922,good morning iris,2022-05-23 00:25:24.930748649+00:00,4,23,False,0
2953,good morning wolf maren,2022-05-23 01:27:03.346803039+00:00,4,24,False,0
2980,good morning iris,2022-06-05 21:15:53.355651118+00:00,4,24,False,0
3540,nibbly/anthro nibbly ref sheet.,2022-04-18 00:43:20.282229713+00:00,4,35,False,0
3956,"sequel to camping modern trio: the morning after, the trio decide to take a dip in the nearby forest lake, except they find out too late that the water is somewhat colder than expected",2021-12-13 02:14:45.900300672+00:00,4,27,False,0
2060,painting of the mona maren,2022-01-03 02:36:57.142868110+00:00,4,28,False,0
1269,"amelia wakes up surprised to find windstraw curled up on her breasts as her new favourite sleeping spot, refusing to move",2022-11-13 22:38:34.206551480+00:00,4,37,False,0
1125,karen gets turned into a wolf and gives a group hug to sythe and wolf maren excited over them being a wolf family for halloween: “we get to be a wolf family!”,2022-10-24 03:49:06.440420305+00:00,4,28,False,0
1848,matriarch dahlia explains to therie the most important dos and don'ts of diplomacy.,2023-02-05 21:20:28.159304725+00:00,4,47,False,0
2514,"sythe being friendly and flirting with what who thinks to be a cute tiger girl. in actuality, it's <database error> post year of the tiger, and she's not purring, she swears. ",2022-02-21 04:26:03.344922949+00:00,4,30,False,0
2002,background : the interior of a dragons cave and their hoard of rare books with the bookcases carved into the caves stone walls. ,2022-01-02 23:43:02.230912281+00:00,4,36,False,0
3546,"sythe gives maren a necklace as a gift, however due to a mix-up, the original necklace got switched with a subtleseed necklace. ",2022-04-18 00:43:20.282229713+00:00,4,34,False,0
3102,"sythe and maren reenact the ""paint me as one of your french girls scene"", and much to maren's surprise sythe is not only a decent artist but is very professional about the whole thing.",2022-06-13 00:21:40.254499684+00:00,4,37,False,0
7486,"please ,let all your charackters blep "":-9"" !!!",2018-11-12 00:32:55.510927387+00:00,3,29,False,0
7904,aftermath of christmas party,2019-01-06 23:48:13.341432161+00:00,3,36,False,0
13757,"red: oh, your playing minecraft i like you cut g smack! karien: aaa",2021-02-14 22:13:07.503697920+00:00,3,19,False,0
530,nib nab with adira and amelia,2022-09-05 01:22:22.568898269+00:00,3,25,False,0
7306,"frankenstein monster w/ different body parts of all wolf, tiger, fox,dragon,basitin & etc",2018-10-14 21:09:02.870503848+00:00,3,36,False,0
1414,brutus getting belly rubs from clovic.,2022-12-12 00:38:56.818447226+00:00,3,24,False,0
8658,basitin saber tail lessons,2019-04-15 01:10:36.200149732+00:00,3,41,False,0
5516,"wrinry is convinced to wear cloths, much to her annoyance.",2017-11-19 23:22:03.372882825+00:00,3,45,False,0
7384,sealeen & lynn discuss the art of diplomacy over dinner.,2018-10-28 20:19:54.958832668+00:00,3,43,False,0
15333,hairball gag remake (or reimagined),2021-07-19 03:11:31.331594613+00:00,3,25,False,0
13269,nibbly keidranised and her body dress for the holidays ,2020-12-21 01:06:09.453252342+00:00,3,20,False,0
12378,all of the virgins in the cast get teleported into a room and can't leave until they figure out what they have in common.,2020-09-20 23:08:55.432815027+00:00,3,24,False,0
15527,"windstraw making biscuits (also, wearing her original bandana from her ref sheet cuz it's cute!)",2021-09-13 01:15:50.661559308+00:00,3,29,False,0
7383,"karen becomes an adrakist, much to her joy.",2018-10-28 20:19:54.958832668+00:00,3,37,False,0
2734,nibbly puts on a collar of dragonification.,2022-05-02 02:06:50.405273847+00:00,3,25,False,0
14798,a redraw of the last panel of page 223 ( badass demon dragon),2021-06-13 23:15:44.876760374+00:00,3,31,False,0
15133,"sealeen and seraphina attempt to rouse landen, who has run out of coffee.",2021-07-11 21:24:48.938744432+00:00,3,21,False,0
13789,"monty python: sarah, sealeen, and landen as the frenchmen in the castle",2021-02-14 23:56:45.059357751+00:00,3,25,False,0
2748,chimera becomes a new grand templar.,2022-05-02 02:06:50.405273847+00:00,3,24,False,0
13691,maren had a dream of her and sythe family portrait  ,2021-02-08 00:23:00.867468861+00:00,3,33,False,0
8562,"adrakist keidran nibbly flying around the manor grounds, looking for trees with acorns to collect for the winter.",2019-04-08 00:52:05.462310872+00:00,3,33,False,0
14847,tktv: brutus winning an 'oscars' style television award for best supporting role. ,2021-06-14 01:07:59.270669916+00:00,3,24,False,0
10236,"magic gone wrong: seraphina has become human, and sealeen and landen are adrakists!",2020-02-24 00:28:21.160623868+00:00,3,22,False,0
5476,"wrinry is finally convinced to wear cloths, much to her annoyance.",2017-11-13 01:14:08.871207510+00:00,3,26,False,0
12488,adora making mixed drinks for patrons at the bar,2020-10-05 01:17:03.354470477+00:00,3,21,False,0
6035,wrinry enjoying a good sleep,2018-02-19 00:08:33.574779032+00:00,3,40,False,0
8587,"keidran nibbly starts hoarding food for winter, hiding stolen food in random places in the estate.",2019-04-14 20:02:02.309131876+00:00,3,61,False,0
12452,the explorers study ancient wall paintings in company of tigress.,2020-10-04 23:21:45.723275227+00:00,3,21,False,0
2300,adira needs more barmaids! let's add a female sythe and keidranified mrs. nibbly to the crew!,2022-02-13 22:07:53.922572270+00:00,3,26,False,0
1417,modern trio as the three ghosts of christmas,2022-12-12 00:38:56.818447226+00:00,3,24,False,0
8625,cathleen telling cornelius she’s pregnant,2019-04-14 23:42:22.538874529+00:00,3,48,False,0
1512,the trio unbox the awesome thing or whatever they bought.,2022-12-18 22:38:52.049500349+00:00,3,29,False,0
3681,good morning cassidy,2021-11-22 02:40:14.383724281+00:00,3,25,False,0
8677,"sythe and mrs nibbly encounter au versions of themselves, where nibs is the keidran and sythe the faithful animal. ",2019-04-21 22:00:16.095302920+00:00,3,43,False,0
12510,sythe's hair has grown into a curly 'fro and he has taken up painting as a hobby. with nibbly on his shoulder he finds the joy of painting happy little trees...,2020-10-05 02:41:56.772601645+00:00,3,22,False,0
11398,"human explorers visit the western basitin territory and try to establish a trade agreement with them, offering gifts for peaceful relations.",2020-06-21 20:23:31.791617994+00:00,3,20,False,0
1522,lt. alice reed finds the winter time in edinmire a lot warmer and enjoyable in her lynx form while a frosty kieren accompanies her out on snow patrol. ,2022-12-18 22:38:52.049500349+00:00,3,21,False,0
660,"sythe brings maren home after their night at the club, and as he leaves, she pulls him into a kiss.",2022-09-12 01:20:46.347635061+00:00,3,26,False,0
15941,keidran tribes come together for a day of peace and thanksgiving ,2021-11-07 21:41:39.711915110+00:00,3,23,False,0
3117,sythe and wolf maren howling at the moon together,2022-06-13 00:21:40.254499684+00:00,3,29,False,0
7874,mrs nibbly taking a confused sythe for a walk on a leash.,2019-01-06 22:20:06.068538581+00:00,3,44,False,0
559,"all species orphanage caretaker's origin: she was a researcher for the templars, back when mary silverlock was still grand templar. she joined them to gain their resources; to achieve her goal in helping keidran live longer and giving basitin magic.",2022-09-05 02:13:54.298537886+00:00,3,29,False,0
5273,"seraphina, punk rock star!",2017-10-16 22:42:14.504847455+00:00,3,33,False,0
643,"red and sythe reflect on how being forced to work together to help keep team b alive has changed them, with red especially realising what an arse he was, and sythe begrudgingly assuring him that he's slowly...slowly getting better about it.",2022-09-12 01:20:46.347635061+00:00,3,29,False,0
1659,northern basitin gives her snow wolf the big news at home with the snow leopard couple congratulating them. the snow wolf before and after reaction to the news.,2023-01-16 00:56:29.493722581+00:00,3,33,False,0
3099,amelia finds a drunk windstraw stuck in the tavern’s tip jar after reaching for something inside and clumsily falling in herself.,2022-06-13 00:21:40.254499684+00:00,3,30,False,0
3792,anklet of humanification - the return of vehra,2021-12-06 02:08:43.772091416+00:00,3,23,False,0
461,good morning matriarch dahlia,2022-08-22 00:57:47.177642951+00:00,3,28,False,0
8183,"maren tavernmage: maren discovers magic, and uses it to clean all the things",2019-02-11 03:12:32.559740454+00:00,3,38,False,0
5563,"one confused squirrel rani as launchpad mcquack in the pilot seat, and a quiet concerned keidran nibs in passenger.",2017-12-10 21:15:21.171180463+00:00,3,29,False,0
8161,"concept drawing of a large, hagrid-like, bear keidran",2019-02-11 01:08:40.685167559+00:00,3,49,False,0
11434,wolf soldier and human soldier dueling on the battlefield.,2020-06-21 22:25:54.960175468+00:00,3,21,False,0
15452,roberto reference sheet,2021-09-06 04:00:32.176678542+00:00,3,19,False,0
5455,the seer's daughter and her menagerie of critters.,2017-11-12 22:08:29.456514053+00:00,3,37,False,0
13221,"sealeen forgets that enchanted mistletoe doesn't work on basitins, but lynn is flattered and gives her a kiss anyway.",2020-12-20 21:22:29.834693749+00:00,3,26,False,0
3086,"keidran kiss 2: maren returns sythe's kiss the keidran way and pulls back with fur on her tongue, much to his amusement.",2022-06-12 22:40:53.442597340+00:00,3,33,False,0
16001,anklet of humanification - human vehra - her memories restored in this new form,2021-11-08 01:37:11.515622008+00:00,3,21,False,0
10009,loona from helluva telling us to fuck off,2020-01-26 21:10:36.773331467+00:00,3,20,False,0
15437,a young windstraw riding on the shoulders of a younger version of the maned wolf from stilt wolf redux,2021-09-06 04:00:32.176678542+00:00,3,23,False,0
5367,the masks in your current style. if that would be considered a spoiler then just neutral.,2017-11-05 21:08:56.565389870+00:00,3,59,False,0
8045,eric joins the rest of the cast on the isles of aphrodisiac,2019-01-21 00:13:54.252401293+00:00,3,33,False,0
3082,modern au: karen starts an internship at her older sisters job (much to maren's dismay),2022-06-12 22:40:53.442597340+00:00,3,29,False,0
1325,sythe as samurai jack vs the three blind archers,2022-11-14 01:49:06.072165533+00:00,3,30,False,0
15040,"prepare for boarding! captain jenny raids erik's ship, but he's too interested in painting her to be scared",2021-07-04 21:50:13.077391783+00:00,3,22,False,0
594,daniels and therie showing their child to daniels' parents and they're actually supportive of them both,2022-09-11 22:19:54.244874106+00:00,3,33,False,0
1737,good morning northern basitin huntress,2023-01-22 22:25:47.241303313+00:00,3,31,False,0
7768,the explorer has decorated her new tail. it's previous owner is not amused.,2018-12-17 01:01:41.638440251+00:00,3,41,False,0
8121,the stone guardian family (w/wife & child),2019-02-04 02:10:46.116414345+00:00,3,28,False,0
3923,"the northern basitin huntress finally has the artic wolf for dinner, with him sitting at a table with some food and other basitin around. the huntress sitting beside him.",2021-12-13 01:50:59.273621429+00:00,3,26,False,0
5141,sunny day stroll with who ever you feel like drawing.,2017-09-25 01:53:00.711611365+00:00,3,26,False,0
15417,"sequel to wolf mary: young mary silverlock gets caught by another templar in her keidran transformation while disrobed and feeling her fur. not being recognized and mistaken for an actual keidran, mary's kicked out before she can explain, left without clothes and unable to change back.",2021-09-06 02:52:27.459815576+00:00,3,21,False,0
7724,seraphina roasting chestnuts with dragon fire,2018-12-16 21:08:51.371820962+00:00,3,46,False,0
14099,"a selection of posters and advertisements from around mekkan, including templar propaganda, calls to war, and classified ads.",2021-04-04 21:41:18.457258680+00:00,3,24,False,0
14057,how the artic wolf and northern basitin meet and later become a couple.,2021-03-22 02:44:11.121138440+00:00,3,35,False,0
4433,euchre's flawless transformation,2017-06-05 01:50:14.107903050+00:00,3,43,False,0
4451,"to make things more even, a male bust chart of the lovely genderbent ladies.",2017-06-05 02:44:58.102213428+00:00,3,28,False,0
4068,sythe and maren mistletoe 3: human sythe gives wolf maren a kiss on the forehead,2021-12-20 04:01:12.673741185+00:00,3,23,False,0
4465,ms. nibbly sleeping on karens face like a kitten,2017-06-05 02:58:20.745799997+00:00,3,33,False,0
14241,"a huge, dragon-sized nibbly smugly flaunting her pet sythe (jabba and slave leia style) ",2021-04-11 23:11:25.683055885+00:00,3,33,False,0
4941,eric paints an image of merie on dry land - much to her dismay,2017-08-27 23:12:50.243073534+00:00,3,51,False,0
4904,"mrs. nibbly in makoto nanaya's (blazblue) outfit, letting her take a fighting pose.",2017-08-20 23:48:55.694841418+00:00,3,31,False,0
8449,"red dressed as dante from devil may cry series, carrying dante's big sword",2019-03-17 20:09:07.409515805+00:00,3,40,False,0
4926,wrinry is finally convinced (begrudgingly) to wear cloths,2017-08-27 20:57:03.531119374+00:00,3,57,False,0
14667,an alluring pinup of iris in bed (good morning series),2021-06-06 21:42:44.224671268+00:00,3,28,False,0
15117,good morning lioness saria,2021-07-11 21:24:48.938744432+00:00,3,30,False,0
1956,twokinds post credits scenes - sythe and maren have settled down and are running their own keidran grooming business together.,2022-01-02 22:03:52.026131685+00:00,3,34,False,0
2006,maren and red dressed as canadian mounted police.,2022-01-02 23:43:02.230912281+00:00,3,28,False,0
1861,two tiger keidran sparring with a martial art inspired by tiger-style kung fu (think master tigress from the “kung fu panda” movies).,2023-02-05 21:20:28.159304725+00:00,3,33,False,0
4708,karen gets another pair of ears! (basitin),2017-07-16 21:39:10.442342141+00:00,3,38,False,0
5654,"wrinry is convinced to wear cloths, much to her annoyance ",2017-12-18 01:11:41.945103856+00:00,3,25,False,0
2845,"brahn's daughter, the seer, becomes the irish war goddess morrigan, from the ulster cycle. she stands atop the ulster mountains, surrounded by a murder of crows.",2022-05-16 02:53:54.732382315+00:00,3,18,False,0
1959,the twokinds show loses its budget due to an error and the episode has to put in blatant product placement to keep going this week.,2022-01-02 22:03:52.026131685+00:00,3,29,False,0
4010,twokinds christmas party viewer pov,2021-12-20 00:41:07.061876257+00:00,3,31,False,0
1272,good morning matriarch dahlia,2022-11-13 22:38:34.206551480+00:00,3,32,False,0
14126,"sythe as minsc from balder's gate telling bedtime stories to mrs. nibbly as boo, while maren as dynaheir is wondering if minsc is loosing his mind.",2021-04-04 23:29:38.195591395+00:00,3,15,False,0
2562,"sythe gifts maren a necklaces, however due to a little mix-up, the original necklace was switched with a subtleseed necklace.",2022-03-07 00:32:06.163009286+00:00,3,23,False,0
2817,"date maren and sythe in the park. maren doesn't know keidran dating customs and therefore very worried. she couldn't think of anything better than throwing a stick. surprisingly, it actually works.",2022-05-16 01:26:41.097484947+00:00,3,27,False,0
14293,"a minor diplomatic incident occurs when the tiger diplomatic party is invited to the legacy estate for negotiations. where they are introduced to the legacys, much to iris's embarrassment. ",2021-04-12 01:25:55.983777768+00:00,3,31,False,0
13433,frankenstein's monster meets red and he thinks a monster is attacking,2021-01-10 21:09:37.664629091+00:00,3,13,False,0
4300,updated bust chart of all female characters,2017-05-10 02:21:09.014198916+00:00,3,21,False,0
4979,eric drawing merie the mermaid - much to her dismay on dry land,2017-09-10 21:45:56.745981717+00:00,3,53,False,0
9266,lynn and sealeen they get their first kiss,2019-10-13 23:15:48.215111589+00:00,3,14,False,0
3976,anklet of humanification - the return of vehra,2021-12-19 22:24:51.753033125+00:00,3,24,False,0
4127,twokinds cast as mass effect andromeda cast,2017-04-09 23:33:42.407810162+00:00,3,50,False,0
14047,nibbly keidranized meeting sythe's family,2021-03-22 01:44:51.115335646+00:00,3,23,False,0
13918,"sythe reenacts the end of neverending story, chasing down rom and rem atop a giant, flying mrs. nibbly.",2021-02-22 01:26:51.149651894+00:00,3,16,False,0
2031,what a party! the snow wolf and northern basitin wake in a vary messed up room and lots of bottles and both of them in bed together.... good? bad? idk?,2022-01-03 01:21:54.054735012+00:00,3,34,False,0
4184,an angry wrinry stomping her feet with puffed out cheaks,2017-04-16 23:16:00.812988010+00:00,3,54,False,0
9098,"the cartographers and tigress noble invited to a show by a tribe of tiger actors/actress. the tigress embarrassed by the show, with the cartographers intrigued by it.",2019-08-19 00:15:34.707355723+00:00,3,25,False,0
9084,the return of pet daughter: confusion on what to wear for her first date,2019-08-19 00:15:34.707355723+00:00,3,21,False,0
9247,what if: sealeen & lynn family portrait,2019-10-13 21:48:35.977927101+00:00,3,14,False,0
14006,colin and sam on a walk!,2021-03-21 23:42:59.864908997+00:00,3,26,False,0
14423,"mary silverlock, as a young adult in her prime, uses transformation magic. she turns into a snow wolf keidran, in her private quarters, to test how the spell works out of morbid curiosity.",2021-05-16 21:44:19.145160565+00:00,3,30,False,0
1060,"a female scp-1471 (mal0) waving at the viewer. don't let her creepy appearance fool you, she's very nice, loving, and just wants to be friends!",2022-10-24 00:34:40.695282432+00:00,3,26,False,0
4977,karen bikini pin-up,2017-09-10 19:49:08.518828907+00:00,3,58,False,0
4385,team a as prohibition-era gangsters,2017-05-21 23:04:30.607272074+00:00,3,40,False,0
14140,"carver is enjoying the good life. he's lounging on the beach, sipping tropical drinks, and being waited on hand and foot by some lovely west basitin ladies.",2021-04-05 02:13:54.680717527+00:00,3,27,False,0
4400,ms. nibbly sleeping on karens face like a kitten,2017-05-22 01:01:52.212105333+00:00,3,38,False,0
2017,genderswap au: tracy's evil smoke hallucination having a freak out/mental breakdown about the pregnancy,2022-01-03 01:21:54.054735012+00:00,3,24,False,0
14390,remus wearing the cone of shame after his run in with nibs,2021-04-19 03:00:35.785879893+00:00,3,28,False,0
9195,sythe’s personal thoughts on maren,2019-10-06 23:16:47.926935096+00:00,3,23,False,0
